news_headline,news_article,news_category,full_text,clean_text,stanford_text
OPPO launches the new F11 Pro with 48MP+5MP Dual Rear Camera,"The all-new OPPO F11 Pro enables users to capture low light moments with its AI Driven 48MP+5MP rear camera. It features Panoramic Screen Display and VOOC 3.0 taking the flash charging technology a step ahead. The smartphone is also powered by P70 chipset for faster, smarter and more robust performance.",technology,"OPPO launches the new F11 Pro with 48MP+5MP Dual Rear Camera. The all-new OPPO F11 Pro enables users to capture low light moments with its AI Driven 48MP+5MP rear camera. It features Panoramic Screen Display and VOOC 3.0 taking the flash charging technology a step ahead. The smartphone is also powered by P70 chipset for faster, smarter and more robust performance.",oppo launch new f11 pro 48mp5mp dual rear camera new oppo f11 pro enable user capture low light moment ai driven 48mp5mp rear camera feature panoramic screen display vooc 3 0 take flash charge technology step ahead smartphone also power p70 chipset faster smart robust performance,"[Tree('ROOT', [Tree('S', [Tree('NP', [Tree('NNP', ['OPPO'])]), Tree('PRN', [Tree('SINV', [Tree('VP', [Tree('VBZ', ['launches']), Tree('NP', [Tree('DT', ['the']), Tree('JJ', ['new']), Tree('NN', ['F11'])]), Tree('NP', [Tree('NP', [Tree('FW', ['Pro'])]), Tree('PP', [Tree('IN', ['with']), Tree('NP', [Tree('CD', ['48MP']), Tree('CD', ['+5'])])])])]), Tree('NP', [Tree('NP', [Tree('NNP', ['MP']), Tree('NNP', ['Dual']), Tree('NNP', ['Rear']), Tree('NNP', ['Camera']), Tree('.', ['.'])]), Tree('SBAR', [Tree('S', [Tree('NP', [Tree('DT', ['The']), Tree('NNP', ['all-new']), Tree('NNP', ['OPPO']), Tree('NNP', ['F11']), Tree('NNP', ['Pro'])]), Tree('VP', [Tree('VBZ', ['enables']), Tree('S', [Tree('NP', [Tree('NNS', ['users'])]), Tree('VP', [Tree('TO', ['to']), Tree('VP', [Tree('VB', ['capture']), Tree('NP', [Tree('JJ', ['low']), Tree('NN', ['light']), Tree('NNS', ['moments'])]), Tree('PP', [Tree('IN', ['with']), Tree('NP', [Tree('PRP$', ['its']), Tree('NNP', ['AI']), Tree('NNP', ['Driven']), Tree('NNP', ['48MP']), Tree('NNP', ['+5']), Tree('NNP', ['MP']), Tree('JJ', ['rear']), Tree('NN', ['camera'])])])])])])]), Tree('.', ['.'])])])]), Tree('S', [Tree('NP', [Tree('PRP', ['It'])]), Tree('VP', [Tree('VBZ', ['features']), Tree('NP', [Tree('NP', [Tree('NNP', ['Panoramic']), Tree('NNP', ['Screen']), Tree('NNP', ['Display']), Tree('CC', ['and']), Tree('NNP', ['VOOC']), Tree('NNP', ['3.0'])]), Tree('VP', [Tree('VBG', ['taking']), Tree('NP', [Tree('NP', [Tree('DT', ['the']), Tree('NN', ['flash'])]), Tree('VP', [Tree('VBG', ['charging']), Tree('NP', [Tree('NN', ['technology'])]), Tree('ADVP', [Tree('NP', [Tree('DT', ['a']), Tree('NN', ['step'])]), Tree('RB', ['ahead'])])])])])])])]), Tree('.', ['.'])])]), Tree('NP', [Tree('DT', ['The']), Tree('NN', ['smartphone'])]), Tree('VP', [Tree('VBZ', ['is']), Tree('ADVP', [Tree('RB', ['also'])]), Tree('VP', [Tree('VBN', ['powered']), Tree('PP', [Tree('IN', ['by']), Tree('NP', [Tree('NP', [Tree('CD', ['P70']), Tree('NN', ['chipset'])]), Tree('PP', [Tree('IN', ['for']), Tree('NP', [Tree('NP', [Tree('JJR', ['faster'])]), Tree(',', [',']), Tree('NP', [Tree('ADJP', [Tree('ADVP', [Tree('RBR', ['smarter']), Tree('CC', ['and']), Tree('RBR', ['more'])]), Tree('JJ', ['robust'])]), Tree('NN', ['performance'])])])])])])])]), Tree('.', ['.'])])])]"
OnePlus March Madness campaign offers various deals on OnePlus 6T,"OnePlus announced the 'March Madness' campaign, as a part of which OnePlus 6T will be available with several offers across Amazon.in, OnePlus.in, Reliance Digital outlets, Croma outlets and OnePlus offline stores. The offers include no-cost EMI up to 6 months and ₹2000 discount on exchange among various others. Additionally, it will offer special giveaways in the form of accessories bundles.",technology,"OnePlus March Madness campaign offers various deals on OnePlus 6T. OnePlus announced the 'March Madness' campaign, as a part of which OnePlus 6T will be available with several offers across Amazon.in, OnePlus.in, Reliance Digital outlets, Croma outlets and OnePlus offline stores. The offers include no-cost EMI up to 6 months and ₹2000 discount on exchange among various others. Additionally, it will offer special giveaways in the form of accessories bundles.",oneplus march madness campaign offer various deal oneplus 6 oneplus announce march madness campaign part oneplus 6 available several offer across amazon oneplus reliance digital outlet croma outlet oneplus offline store offer include no cost emi 6 month 2000 discount exchange among various additionally offer special giveaway form accessory bundle,"[Tree('ROOT', [Tree('S', [Tree('SBAR', [Tree('X', [Tree('NP', [Tree('NP', [Tree('NNP', ['OnePlus']), Tree('NNP', ['March']), Tree('NNP', ['Madness'])]), Tree('NP', [Tree('NN', ['campaign']), Tree('NNS', ['offers'])])]), Tree('NP', [Tree('NP', [Tree('JJ', ['various']), Tree('NNS', ['deals'])]), Tree('PP', [Tree('IN', ['on']), Tree('NP', [Tree('NNP', ['OnePlus']), Tree('CD', ['6T'])])])]), Tree('.', ['.'])]), Tree('S', [Tree('NP', [Tree('NNP', ['OnePlus'])]), Tree('VP', [Tree('VBD', ['announced']), Tree('NP', [Tree('DT', ['the']), Tree('``', ['`']), Tree('NNP', ['March']), Tree('NNPS', ['Madness']), Tree(""''"", [""'""]), Tree('NN', ['campaign'])]), Tree(',', [',']), Tree('PP', [Tree('IN', ['as']), Tree('NP', [Tree('NP', [Tree('DT', ['a']), Tree('NN', ['part'])]), Tree('SBAR', [Tree('WHPP', [Tree('IN', ['of']), Tree('WHNP', [Tree('WDT', ['which'])])]), Tree('S', [Tree('NP', [Tree('NNP', ['OnePlus']), Tree('CD', ['6T'])]), Tree('VP', [Tree('MD', ['will']), Tree('VP', [Tree('VB', ['be']), Tree('ADJP', [Tree('JJ', ['available']), Tree('PP', [Tree('IN', ['with']), Tree('SBAR', [Tree('WHNP', [Tree('NP', [Tree('JJ', ['several']), Tree('NNS', ['offers'])]), Tree('PP', [Tree('IN', ['across']), Tree('NP', [Tree('NP', [Tree('NNP', ['Amazon.in'])]), Tree(',', [',']), Tree('NP', [Tree('NNP', ['OnePlus.in'])]), Tree(',', [',']), Tree('NP', [Tree('NNP', ['Reliance']), Tree('NNP', ['Digital']), Tree('NNS', ['outlets'])]), Tree(',', [',']), Tree('NP', [Tree('NNP', ['Croma']), Tree('NNS', ['outlets'])]), Tree('CC', ['and']), Tree('NP', [Tree('NNP', ['OnePlus']), Tree('NN', ['offline']), Tree('NNS', ['stores'])])]), Tree('.', ['.'])])]), Tree('S', [Tree('NP', [Tree('DT', ['The']), Tree('NNS', ['offers'])]), Tree('VP', [Tree('VBP', ['include']), Tree('NP', [Tree('NP', [Tree('NP', [Tree('JJ', ['no-cost']), Tree('NN', ['EMI'])]), Tree('NP', [Tree('QP', [Tree('IN', ['up']), Tree('TO', ['to']), Tree('CD', ['6'])]), Tree('NNS', ['months'])])]), Tree('CC', ['and']), Tree('NP', [Tree('NP', [Tree('CD', ['2000']), Tree('NN', ['discount'])]), Tree('PP', [Tree('IN', ['on']), Tree('NP', [Tree('NN', ['exchange'])])])])]), Tree('FRAG', [Tree('PP', [Tree('IN', ['among']), Tree('NP', [Tree('JJ', ['various']), Tree('NNS', ['others'])])]), Tree('.', ['.'])])])])])])]), Tree('ADVP', [Tree('RB', ['Additionally'])])])])])])])])])])]), Tree(',', [',']), Tree('NP', [Tree('PRP', ['it'])]), Tree('VP', [Tree('MD', ['will']), Tree('VP', [Tree('VB', ['offer']), Tree('NP', [Tree('JJ', ['special']), Tree('NNS', ['giveaways'])]), Tree('PP', [Tree('IN', ['in']), Tree('NP', [Tree('NP', [Tree('DT', ['the']), Tree('NN', ['form'])]), Tree('PP', [Tree('IN', ['of']), Tree('NP', [Tree('NNS', ['accessories']), Tree('NNS', ['bundles'])])])])])])]), Tree('.', ['.'])])])]"
Google finds it paid men less than women for the same job,"Google in its own internal audit found the company was paying men working as Level 4 Software Engineers ""less discretionary funds than women"" in the same role in 2018. Google ended up paying $9.7 million in pay adjustments to 10,677 employees during the year, which included new employees. However, Google did not specify how many of these employees were men.",technology,"Google finds it paid men less than women for the same job. Google in its own internal audit found the company was paying men working as Level 4 Software Engineers ""less discretionary funds than women"" in the same role in 2018. Google ended up paying $9.7 million in pay adjustments to 10,677 employees during the year, which included new employees. However, Google did not specify how many of these employees were men.",google find pay man less woman job google internal audit find company pay man work level 4 software engineer less discretionary fund woman role 2018 google end pay 9 7 million pay adjustment 10677 employee year include new employee however google not specify many employee man,"[Tree('ROOT', [Tree('S', [Tree('S', [Tree('NP', [Tree('NNP', ['Google'])]), Tree('VP', [Tree('VBZ', ['finds']), Tree('SBAR', [Tree('S', [Tree('NP', [Tree('PRP', ['it'])]), Tree('VP', [Tree('VBD', ['paid']), Tree('S', [Tree('NP', [Tree('NNS', ['men'])]), Tree('ADJP', [Tree('JJR', ['less'])]), Tree('SBAR', [Tree('PP', [Tree('IN', ['than']), Tree('NP', [Tree('NP', [Tree('NNS', ['women'])]), Tree('PP', [Tree('IN', ['for']), Tree('NP', [Tree('DT', ['the']), Tree('JJ', ['same']), Tree('NN', ['job'])])])]), Tree('.', ['.'])]), Tree('S', [Tree('NP', [Tree('NP', [Tree('NNP', ['Google'])]), Tree('PP', [Tree('IN', ['in']), Tree('NP', [Tree('PRP$', ['its']), Tree('JJ', ['own']), Tree('JJ', ['internal']), Tree('NN', ['audit'])])])]), Tree('VP', [Tree('VBD', ['found']), Tree('SBAR', [Tree('S', [Tree('NP', [Tree('DT', ['the']), Tree('NN', ['company'])]), Tree('VP', [Tree('VBD', ['was']), Tree('VP', [Tree('VBG', ['paying']), Tree('NP', [Tree('NP', [Tree('NNS', ['men'])]), Tree('VP', [Tree('VBG', ['working']), Tree('PP', [Tree('IN', ['as']), Tree('NP', [Tree('NNP', ['Level'])])])])]), Tree('FRAG', [Tree('X', [Tree('NP', [Tree('NP', [Tree('CD', ['4'])]), Tree('NP', [Tree('NNP', ['Software']), Tree('NNPS', ['Engineers'])])]), Tree('NP', [Tree('NP', [Tree('``', ['``']), Tree('NP', [Tree('JJR', ['less']), Tree('JJ', ['discretionary']), Tree('NNS', ['funds'])]), Tree('PP', [Tree('IN', ['than']), Tree('NP', [Tree('NNS', ['women'])])]), Tree(""''"", [""''""])]), Tree('PP', [Tree('IN', ['in']), Tree('NP', [Tree('NP', [Tree('DT', ['the']), Tree('JJ', ['same']), Tree('NN', ['role'])]), Tree('PP', [Tree('IN', ['in']), Tree('NP', [Tree('CD', ['2018'])])])])])]), Tree('.', ['.'])]), Tree(':', ['Google']), Tree('VP', [Tree('VBD', ['ended']), Tree('PRT', [Tree('RP', ['up'])]), Tree('S', [Tree('VP', [Tree('VBG', ['paying']), Tree('NP', [Tree('NP', [Tree('QP', [Tree('$', ['$']), Tree('CD', ['9.7']), Tree('CD', ['million'])])]), Tree('PP', [Tree('IN', ['in']), Tree('NP', [Tree('NN', ['pay']), Tree('NNS', ['adjustments'])])])]), Tree('PP', [Tree('TO', ['to']), Tree('NP', [Tree('CD', ['10,677']), Tree('NNS', ['employees'])])]), Tree('PP', [Tree('IN', ['during']), Tree('NP', [Tree('NP', [Tree('DT', ['the']), Tree('NN', ['year'])]), Tree(',', [',']), Tree('SBAR', [Tree('WHNP', [Tree('WDT', ['which'])]), Tree('S', [Tree('VP', [Tree('VBD', ['included']), Tree('NP', [Tree('JJ', ['new']), Tree('NNS', ['employees'])])])])])])])])])]), Tree('.', ['.'])])])])])])])])])]), Tree('ADVP', [Tree('RB', ['However'])])])])])])]), Tree(',', [',']), Tree('NP', [Tree('NNP', ['Google'])]), Tree('VP', [Tree('VBD', ['did']), Tree('RB', ['not']), Tree('VP', [Tree('VB', ['specify']), Tree('SBAR', [Tree('WHADVP', [Tree('WRB', ['how'])]), Tree('S', [Tree('NP', [Tree('NP', [Tree('JJ', ['many'])]), Tree('PP', [Tree('IN', ['of']), Tree('NP', [Tree('DT', ['these']), Tree('NNS', ['employees'])])])]), Tree('VP', [Tree('VBD', ['were']), Tree('NP', [Tree('NNS', ['men'])])])])])])]), Tree('.', ['.'])])])]"
Donald Trump mistakenly calls Apple CEO Tim Cook 'Tim Apple',"US President Donald Trump mistakenly called Apple CEO Tim Cook 'Tim Apple' at a conference in the White House. In videos that surfaced online, Tim Cook, who is sitting next to Trump, can be seen nodding after Trump's mistake. ""You have really put a big investment in our country. We really appreciate it very much, Tim Apple,"" Trump said.",technology,"Donald Trump mistakenly calls Apple CEO Tim Cook 'Tim Apple'. US President Donald Trump mistakenly called Apple CEO Tim Cook 'Tim Apple' at a conference in the White House. In videos that surfaced online, Tim Cook, who is sitting next to Trump, can be seen nodding after Trump's mistake. ""You have really put a big investment in our country. We really appreciate it very much, Tim Apple,"" Trump said.",donald trump mistakenly call apple ceo tim cook tim apple us president donald trump mistakenly call apple ceo tim cook tim apple conference white house video surface online tim cook sit next trump see nod trump mistake really put big investment country really appreciate much tim apple trump say,"[Tree('ROOT', [Tree('S', [Tree('SBAR', [Tree('X', [Tree('NP', [Tree('NP', [Tree('NNP', ['Donald']), Tree('NNP', ['Trump'])]), Tree('NP', [Tree('JJ', ['mistakenly']), Tree('NNS', ['calls'])])]), Tree('NP', [Tree('NP', [Tree('NNP', ['Apple']), Tree('NNP', ['CEO']), Tree('NNP', ['Tim'])]), Tree('NP', [Tree('NNP', ['Cook']), Tree('``', ['`']), Tree('NNP', ['Tim']), Tree('NNP', ['Apple']), Tree(""''"", [""'""])])]), Tree('.', ['.'])]), Tree('S', [Tree('NP', [Tree('NNP', ['US']), Tree('NNP', ['President']), Tree('NNP', ['Donald']), Tree('NNP', ['Trump'])]), Tree('ADVP', [Tree('RB', ['mistakenly'])]), Tree('VP', [Tree('VBD', ['called']), Tree('NP', [Tree('NP', [Tree('NNP', ['Apple']), Tree('NNP', ['CEO']), Tree('NNP', ['Tim']), Tree('NNP', ['Cook'])]), Tree('``', ['`']), Tree('NP', [Tree('NNP', ['Tim']), Tree('NNP', ['Apple'])]), Tree(""''"", [""'""])]), Tree('PP', [Tree('IN', ['at']), Tree('NP', [Tree('NP', [Tree('DT', ['a']), Tree('NN', ['conference'])]), Tree('PP', [Tree('IN', ['in']), Tree('NP', [Tree('DT', ['the']), Tree('NNP', ['White']), Tree('NNP', ['House']), Tree('.', ['.'])])])])]), Tree('SBAR', [Tree('S', [Tree('PP', [Tree('IN', ['In']), Tree('NP', [Tree('NP', [Tree('NNS', ['videos'])]), Tree('SBAR', [Tree('IN', ['that']), Tree('SINV', [Tree('VP', [Tree('VBD', ['surfaced']), Tree('SBAR', [Tree('S', [Tree('NP', [Tree('NP', [Tree('JJ', ['online'])]), Tree(',', [',']), Tree('NP', [Tree('NNP', ['Tim']), Tree('NNP', ['Cook'])]), Tree(',', [',']), Tree('SBAR', [Tree('WHNP', [Tree('WP', ['who'])]), Tree('S', [Tree('VP', [Tree('VBZ', ['is']), Tree('VP', [Tree('VBG', ['sitting']), Tree('ADVP', [Tree('JJ', ['next'])]), Tree('PP', [Tree('TO', ['to']), Tree('NP', [Tree('NNP', ['Trump'])])])])])])]), Tree(',', [','])]), Tree('VP', [Tree('MD', ['can']), Tree('VP', [Tree('VB', ['be']), Tree('VP', [Tree('VBN', ['seen']), Tree('S', [Tree('VP', [Tree('VBG', ['nodding']), Tree('PP', [Tree('IN', ['after'])])])])])])])])])]), Tree('NP', [Tree('NP', [Tree('NNP', ['Trump']), Tree('POS', [""'s""])]), Tree('NN', ['mistake'])]), Tree('.', ['.']), Tree('``', ['``']), Tree('S', [Tree('NP', [Tree('PRP', ['You'])]), Tree('VP', [Tree('VBP', ['have']), Tree('ADVP', [Tree('RB', ['really'])]), Tree('VP', [Tree('VBN', ['put']), Tree('NP', [Tree('NP', [Tree('DT', ['a']), Tree('JJ', ['big']), Tree('NN', ['investment'])]), Tree('PP', [Tree('IN', ['in']), Tree('NP', [Tree('PRP$', ['our']), Tree('NN', ['country'])])])])])])]), Tree('.', ['.'])])])])]), Tree('NP', [Tree('PRP', ['We'])]), Tree('VP', [Tree('ADVP', [Tree('RB', ['really'])]), Tree('VBP', ['appreciate']), Tree('NP', [Tree('PRP', ['it'])]), Tree('ADVP', [Tree('RB', ['very']), Tree('RB', ['much'])])])])])])])]), Tree(',', [',']), Tree('NP', [Tree('NNP', ['Tim']), Tree('NNP', ['Apple'])]), Tree(',', [',']), Tree(""''"", [""''""]), Tree('NP', [Tree('NNP', ['Trump'])]), Tree('VP', [Tree('VBD', ['said'])]), Tree('.', ['.'])])])]"
Lego trolls foldable smartphones with its own foldable product,"Danish company Lego trolled foldable phones on Twitter with an image of its own foldable product, 'Lego Fold' captioned, ""For endless creative play that never runs out of battery"". Described as having a ""5-inch cover display [that] unfolds into...11-inch...storybook"", Lego Fold is Lego's 3D pop-up storybook product. Last month, companies including Samsung and Huawei unveiled foldable phones. ",technology,"Lego trolls foldable smartphones with its own foldable product. Danish company Lego trolled foldable phones on Twitter with an image of its own foldable product, 'Lego Fold' captioned, ""For endless creative play that never runs out of battery"". Described as having a ""5-inch cover display [that] unfolds into...11-inch...storybook"", Lego Fold is Lego's 3D pop-up storybook product. Last month, companies including Samsung and Huawei unveiled foldable phones. ",lego troll foldable smartphone foldable product danish company lego troll foldable phone twitter image foldable product lego fold captioned endless creative play never run battery describe 5inch cover display [ ] unfold 11inch storybook lego fold legos 3d pop storybook product last month company include samsung huawei unveil foldable phone,"[Tree('ROOT', [Tree('S', [Tree('SBAR', [Tree('X', [Tree('NP', [Tree('NP', [Tree('NNP', ['Lego'])]), Tree('NP', [Tree('NNS', ['trolls'])])]), Tree('NP', [Tree('NP', [Tree('JJ', ['foldable']), Tree('NNS', ['smartphones'])]), Tree('PP', [Tree('IN', ['with']), Tree('NP', [Tree('PRP$', ['its']), Tree('JJ', ['own']), Tree('JJ', ['foldable']), Tree('NN', ['product'])])])]), Tree('.', ['.'])]), Tree('S', [Tree('NP', [Tree('JJ', ['Danish']), Tree('NN', ['company']), Tree('NNP', ['Lego'])]), Tree('VP', [Tree('VBD', ['trolled']), Tree('NP', [Tree('JJ', ['foldable']), Tree('NNS', ['phones'])]), Tree('PP', [Tree('IN', ['on']), Tree('NP', [Tree('NNP', ['Twitter'])])]), Tree('PP', [Tree('IN', ['with']), Tree('NP', [Tree('NP', [Tree('DT', ['an']), Tree('NN', ['image'])]), Tree('PP', [Tree('IN', ['of']), Tree('NP', [Tree('PRP$', ['its']), Tree('JJ', ['own']), Tree('JJ', ['foldable']), Tree('NN', ['product'])])]), Tree('PRN', [Tree(',', [',']), Tree('S', [Tree('``', ['`']), Tree('NP', [Tree('NNP', ['Lego']), Tree('NNP', ['Fold'])]), Tree(""''"", [""'""]), Tree('VP', [Tree('VBD', ['captioned'])])]), Tree(',', [','])]), Tree('``', ['``']), Tree('S', [Tree('PP', [Tree('IN', ['For']), Tree('NP', [Tree('NP', [Tree('NP', [Tree('NP', [Tree('JJ', ['endless']), Tree('JJ', ['creative']), Tree('NN', ['play'])]), Tree('SBAR', [Tree('WHNP', [Tree('WDT', ['that'])]), Tree('S', [Tree('ADVP', [Tree('RB', ['never'])]), Tree('VP', [Tree('VBZ', ['runs']), Tree('PRT', [Tree('RP', ['out'])]), Tree('PP', [Tree('IN', ['of']), Tree('NP', [Tree('NN', ['battery'])])]), Tree(""''"", [""''""])])])])]), Tree('.', ['.']), Tree('NP', [Tree('NP', [Tree('NNP', ['Described'])]), Tree('PP', [Tree('IN', ['as'])])])]), Tree('VP', [Tree('VBG', ['having']), Tree('NP', [Tree('DT', ['a']), Tree('``', ['``']), Tree('JJ', ['5-inch']), Tree('NN', ['cover']), Tree('NN', ['display']), Tree('NN', ['-LSB-'])]), Tree('SBAR', [Tree('IN', ['that']), Tree('S', [Tree('NP', [Tree('NNP', ['-RSB-'])]), Tree('VP', [Tree('VBZ', ['unfolds']), Tree('NP', [Tree('NP', [Tree('JJ', ['into...11-inch'])]), Tree(':', ['...']), Tree('NP', [Tree('NN', ['storybook'])]), Tree(""''"", [""''""])])])])])])])]), Tree(',', [',']), Tree('NP', [Tree('NNP', ['Lego']), Tree('NNP', ['Fold'])]), Tree('VP', [Tree('VBZ', ['is']), Tree('NP', [Tree('NP', [Tree('NNP', ['Lego']), Tree('POS', [""'s""])]), Tree('CD', ['3D']), Tree('JJ', ['pop-up']), Tree('NN', ['storybook']), Tree('NN', ['product'])])]), Tree('.', ['.'])])])])])])]), Tree('NP', [Tree('JJ', ['Last']), Tree('NN', ['month'])]), Tree(',', [',']), Tree('NP', [Tree('NP', [Tree('NNS', ['companies'])]), Tree('PP', [Tree('VBG', ['including']), Tree('NP', [Tree('NNP', ['Samsung']), Tree('CC', ['and']), Tree('NNP', ['Huawei'])])])]), Tree('VP', [Tree('VBD', ['unveiled']), Tree('NP', [Tree('JJ', ['foldable']), Tree('NNS', ['phones'])])]), Tree('.', ['.'])])])]"
T-Series getting desperate: PewDiePie as they ask for subscribers,"Swedish YouTuber PewDiePie has responded after T-Series Chairman Bhushan Kumar asked for more YouTube subscribers to become the world's most subscribed to channel on the Google-owned platform. ""They are getting desperate"", PewDiePie replied to Kumar's ""We can make history. We can make India win"" tweet. Earlier, a PewDiePie fan hacked 50,000 printers, causing them to print ""help defeat T-Series"".",technology,"T-Series getting desperate: PewDiePie as they ask for subscribers. Swedish YouTuber PewDiePie has responded after T-Series Chairman Bhushan Kumar asked for more YouTube subscribers to become the world's most subscribed to channel on the Google-owned platform. ""They are getting desperate"", PewDiePie replied to Kumar's ""We can make history. We can make India win"" tweet. Earlier, a PewDiePie fan hacked 50,000 printers, causing them to print ""help defeat T-Series"".",series get desperate pewdiepie ask subscriber swedish youtuber pewdiepie respond series chairman bhushan kumar ask youtube subscriber become world subscribe channel google platform get desperate pewdiepie reply kumar make history make india win tweet earlier pewdiepie fan hack 50000 printer cause print help defeat series,"[Tree('ROOT', [Tree('S', [Tree('S', [Tree('NP', [Tree('NP', [Tree('NNS', ['T-Series'])]), Tree('VP', [Tree('VBG', ['getting']), Tree('ADJP', [Tree('JJ', ['desperate'])]), Tree('UCP', [Tree(':', [':']), Tree('S', [Tree('NP', [Tree('NP', [Tree('NNP', ['PewDiePie'])]), Tree('PP', [Tree('IN', ['as']), Tree('NP', [Tree('PRP', ['they'])])])]), Tree('VP', [Tree('VBP', ['ask']), Tree('SBAR', [Tree('IN', ['for']), Tree('S', [Tree('NP', [Tree('NNP', ['subscribers']), Tree('.', ['.']), Tree('NNP', ['Swedish']), Tree('NNP', ['YouTuber']), Tree('NNP', ['PewDiePie'])]), Tree('VP', [Tree('VBZ', ['has']), Tree('VP', [Tree('VBN', ['responded']), Tree('PP', [Tree('IN', ['after']), Tree('NP', [Tree('NP', [Tree('NNP', ['T-Series']), Tree('NNP', ['Chairman']), Tree('NNP', ['Bhushan']), Tree('NNP', ['Kumar'])]), Tree('VP', [Tree('VBN', ['asked']), Tree('PP', [Tree('IN', ['for']), Tree('NP', [Tree('JJR', ['more']), Tree('NNP', ['YouTube']), Tree('NNS', ['subscribers'])])]), Tree('S', [Tree('VP', [Tree('TO', ['to']), Tree('VP', [Tree('VB', ['become']), Tree('NP', [Tree('NP', [Tree('DT', ['the']), Tree('NN', ['world']), Tree('POS', [""'s""])]), Tree('JJS', ['most']), Tree('NN', ['subscribed'])]), Tree('S', [Tree('VP', [Tree('TO', ['to']), Tree('VP', [Tree('VB', ['channel']), Tree('PP', [Tree('IN', ['on']), Tree('NP', [Tree('DT', ['the']), Tree('JJ', ['Google-owned']), Tree('NN', ['platform'])])])])])])])])])])])])])])])])])]), Tree('.', ['.'])])])]), Tree('``', ['``']), Tree('NP', [Tree('PRP', ['They'])]), Tree('VP', [Tree('VBP', ['are']), Tree('VP', [Tree('VBG', ['getting']), Tree('ADJP', [Tree('JJ', ['desperate'])])])]), Tree(""''"", [""''""])]), Tree(',', [',']), Tree('NP', [Tree('NNP', ['PewDiePie'])]), Tree('VP', [Tree('VBD', ['replied']), Tree('PP', [Tree('TO', ['to']), Tree('NP', [Tree('NP', [Tree('NP', [Tree('NP', [Tree('NNP', ['Kumar']), Tree('POS', [""'s""])]), Tree('``', ['``']), Tree('S', [Tree('NP', [Tree('PRP', ['We'])]), Tree('VP', [Tree('MD', ['can']), Tree('VP', [Tree('VB', ['make']), Tree('SBAR', [Tree('S', [Tree('INTJ', [Tree('NN', ['history']), Tree('.', ['.'])]), Tree('NP', [Tree('PRP', ['We'])]), Tree('VP', [Tree('MD', ['can']), Tree('VP', [Tree('VB', ['make']), Tree('S', [Tree('NP', [Tree('NNP', ['India'])]), Tree('VP', [Tree('VB', ['win'])])])])])])])])])]), Tree(""''"", [""''""]), Tree('NN', ['tweet'])]), Tree('.', ['.']), Tree('NP', [Tree('NP', [Tree('JJR', ['Earlier'])]), Tree(',', [',']), Tree('NP', [Tree('DT', ['a']), Tree('JJ', ['PewDiePie']), Tree('NN', ['fan'])])])]), Tree('VP', [Tree('VBN', ['hacked']), Tree('NP', [Tree('CD', ['50,000']), Tree('NNS', ['printers'])]), Tree(',', [',']), Tree('S', [Tree('VP', [Tree('VBG', ['causing']), Tree('S', [Tree('NP', [Tree('PRP', ['them'])]), Tree('VP', [Tree('TO', ['to']), Tree('VP', [Tree('VB', ['print']), Tree('``', ['``']), Tree('NP', [Tree('NN', ['help']), Tree('NN', ['defeat']), Tree('NNS', ['T-Series'])]), Tree(""''"", [""''""])])])])])])])])])]), Tree('.', ['.'])])])]"
