news_headline,news_article,news_category,full_text,clean_text,stanford_text
Was raped in Air Force: 1st US female fighter pilot to fly in combat,"US Senator Martha McSally, who was the first female US fighter pilot to fly in combat, has revealed she ""was preyed upon and raped by a superior officer"" while in the Air Force. Talking about how her attempt to share her experiences was handled, McSally said, ""Like many victims, I felt like the system was raping me all over again.""",world,"Was raped in Air Force: 1st US female fighter pilot to fly in combat. US Senator Martha McSally, who was the first female US fighter pilot to fly in combat, has revealed she ""was preyed upon and raped by a superior officer"" while in the Air Force. Talking about how her attempt to share her experiences was handled, McSally said, ""Like many victims, I felt like the system was raping me all over again.""",rap air force 1st us female fighter pilot fly combat us senator martha mcsally first female us fighter pilot fly combat reveal prey upon rap superior officer air force talk attempt share experience handle mcsally say like many victim feel like system rap,"[Tree('ROOT', [Tree('SINV', [Tree('VP', [Tree('VBD', ['Was']), Tree('VP', [Tree('VBN', ['raped']), Tree('PP', [Tree('IN', ['in']), Tree('NP', [Tree('NNP', ['Air']), Tree('NNP', ['Force'])])]), Tree(':', [':']), Tree('FRAG', [Tree('NP', [Tree('NP', [Tree('NNP', ['1st']), Tree('NNP', ['US']), Tree('JJ', ['female']), Tree('NN', ['fighter']), Tree('NN', ['pilot'])]), Tree('SBAR', [Tree('S', [Tree('VP', [Tree('TO', ['to']), Tree('VP', [Tree('VB', ['fly']), Tree('PP', [Tree('IN', ['in']), Tree('NP', [Tree('NN', ['combat'])])])])])])])]), Tree('.', ['.'])])])]), Tree('NP', [Tree('NP', [Tree('NNP', ['US']), Tree('NNP', ['Senator']), Tree('NNP', ['Martha']), Tree('NNP', ['McSally'])]), Tree(',', [',']), Tree('SBAR', [Tree('WHNP', [Tree('WP', ['who'])]), Tree('S', [Tree('VP', [Tree('VP', [Tree('VBD', ['was']), Tree('VP', [Tree('NP', [Tree('DT', ['the']), Tree('JJ', ['first']), Tree('JJ', ['female']), Tree('NNP', ['US']), Tree('NN', ['fighter']), Tree('NN', ['pilot'])]), Tree('S', [Tree('VP', [Tree('TO', ['to']), Tree('VP', [Tree('VB', ['fly']), Tree('PP', [Tree('IN', ['in']), Tree('NP', [Tree('NN', ['combat'])])])])])])])]), Tree(',', [',']), Tree('VP', [Tree('VBZ', ['has']), Tree('VP', [Tree('VBN', ['revealed']), Tree('SBAR', [Tree('S', [Tree('NP', [Tree('PRP', ['she'])]), Tree('``', ['``']), Tree('VP', [Tree('VBD', ['was']), Tree('VP', [Tree('VBN', ['preyed']), Tree('PP', [Tree('RB', ['upon'])])])])])])])]), Tree('CC', ['and']), Tree('VP', [Tree('VBD', ['raped']), Tree('PP', [Tree('IN', ['by']), Tree('NP', [Tree('DT', ['a']), Tree('JJ', ['superior']), Tree('NN', ['officer'])])]), Tree(""''"", [""''""]), Tree('SBAR', [Tree('IN', ['while']), Tree('S', [Tree('PP', [Tree('IN', ['in']), Tree('NP', [Tree('NP', [Tree('DT', ['the']), Tree('NNP', ['Air']), Tree('NNP', ['Force']), Tree('.', ['.']), Tree('NNP', ['Talking'])]), Tree('PP', [Tree('IN', ['about']), Tree('SBAR', [Tree('WHADVP', [Tree('WRB', ['how'])]), Tree('S', [Tree('NP', [Tree('PRP$', ['her']), Tree('NN', ['attempt']), Tree('S', [Tree('VP', [Tree('TO', ['to']), Tree('VP', [Tree('VB', ['share']), Tree('NP', [Tree('PRP$', ['her']), Tree('NNS', ['experiences'])])])])])]), Tree('VP', [Tree('VBD', ['was']), Tree('VP', [Tree('VBN', ['handled'])])])])])])])]), Tree(',', [',']), Tree('NP', [Tree('NNP', ['McSally'])]), Tree('VP', [Tree('VBD', ['said'])])])])])])])])]), Tree(',', [',']), Tree('``', ['``']), Tree('S', [Tree('PP', [Tree('IN', ['Like']), Tree('NP', [Tree('JJ', ['many']), Tree('NNS', ['victims'])])]), Tree(',', [',']), Tree('NP', [Tree('PRP', ['I'])]), Tree('VP', [Tree('VBD', ['felt']), Tree('SBAR', [Tree('IN', ['like']), Tree('S', [Tree('NP', [Tree('DT', ['the']), Tree('NN', ['system'])]), Tree('VP', [Tree('VBD', ['was']), Tree('VP', [Tree('VBG', ['raping']), Tree('NP', [Tree('PRP', ['me'])]), Tree('ADVP', [Tree('DT', ['all']), Tree('IN', ['over']), Tree('RB', ['again'])])])])])])])]), Tree('.', ['.']), Tree(""''"", [""''""])])])]"
Pakistan names pilots who it claims shot down 2 Indian jets,"Pakistan's Foreign Minister Shah Mahmood Qureshi on Wednesday named Pakistan Air Force pilots who he claims downed two Indian jets. ""One Indian jet was shot down by Squadron Leader Hassan Siddiqui while other was downed by Wing Commander Nauman Ali Khan,"" Qureshi said. India said that it lost only one MiG-21 Bison and had shot down one Pakistani F-16 jet.",world,"Pakistan names pilots who it claims shot down 2 Indian jets. Pakistan's Foreign Minister Shah Mahmood Qureshi on Wednesday named Pakistan Air Force pilots who he claims downed two Indian jets. ""One Indian jet was shot down by Squadron Leader Hassan Siddiqui while other was downed by Wing Commander Nauman Ali Khan,"" Qureshi said. India said that it lost only one MiG-21 Bison and had shot down one Pakistani F-16 jet.",pakistan name pilot claim shoot 2 indian jet pakistan foreign minister shah mahmood qureshi wednesday name pakistan air force pilot claim two indian jet one indian jet shoot squadron leader hassan siddiqui wing commander nauman ali khan qureshi say india say lose one mig21 bison shoot one pakistani f16 jet,"[Tree('ROOT', [Tree('S', [Tree('NP', [Tree('NP', [Tree('JJ', ['Pakistan']), Tree('NNS', ['names']), Tree('NNS', ['pilots'])]), Tree('SBAR', [Tree('WHNP', [Tree('WP', ['who'])]), Tree('S', [Tree('NP', [Tree('PRP', ['it'])]), Tree('VP', [Tree('VBZ', ['claims'])])])])]), Tree('VP', [Tree('VBD', ['shot']), Tree('SBAR', [Tree('S', [Tree('SBAR', [Tree('X', [Tree('ADVP', [Tree('RB', ['down']), Tree('NP', [Tree('CD', ['2'])])]), Tree('NP', [Tree('JJ', ['Indian']), Tree('NNS', ['jets'])]), Tree('.', ['.'])]), Tree('S', [Tree('NP', [Tree('NP', [Tree('NP', [Tree('NNP', ['Pakistan']), Tree('POS', [""'s""])]), Tree('NNP', ['Foreign']), Tree('NNP', ['Minister']), Tree('NNP', ['Shah']), Tree('NNP', ['Mahmood']), Tree('NNP', ['Qureshi'])]), Tree('PP', [Tree('IN', ['on']), Tree('NP', [Tree('NNP', ['Wednesday'])])])]), Tree('VP', [Tree('VBD', ['named']), Tree('NP', [Tree('NP', [Tree('NNP', ['Pakistan']), Tree('NNP', ['Air']), Tree('NNP', ['Force']), Tree('NNS', ['pilots'])]), Tree('SBAR', [Tree('WHNP', [Tree('WP', ['who'])]), Tree('S', [Tree('NP', [Tree('PRP', ['he'])]), Tree('VP', [Tree('VBZ', ['claims']), Tree('SBAR', [Tree('SINV', [Tree('VP', [Tree('VBD', ['downed'])]), Tree('NP', [Tree('CD', ['two']), Tree('JJ', ['Indian']), Tree('NNS', ['jets'])]), Tree('.', ['.']), Tree('``', ['``']), Tree('S', [Tree('NP', [Tree('CD', ['One']), Tree('JJ', ['Indian']), Tree('NN', ['jet'])]), Tree('VP', [Tree('VBD', ['was']), Tree('VP', [Tree('VBN', ['shot']), Tree('PRT', [Tree('RP', ['down'])]), Tree('PP', [Tree('IN', ['by']), Tree('NP', [Tree('NP', [Tree('NNP', ['Squadron']), Tree('NNP', ['Leader']), Tree('NNP', ['Hassan']), Tree('NNP', ['Siddiqui'])]), Tree('SBAR', [Tree('S', [Tree('SBAR', [Tree('IN', ['while']), Tree('S', [Tree('NP', [Tree('JJ', ['other'])]), Tree('VP', [Tree('VBD', ['was']), Tree('VP', [Tree('VBN', ['downed']), Tree('PP', [Tree('IN', ['by']), Tree('NP', [Tree('NNP', ['Wing']), Tree('NNP', ['Commander']), Tree('NNP', ['Nauman']), Tree('NNP', ['Ali']), Tree('NNP', ['Khan'])])])])])])]), Tree(',', [',']), Tree(""''"", [""''""]), Tree('NP', [Tree('NNP', ['Qureshi'])]), Tree('VP', [Tree('VBD', ['said'])])])])])])])])]), Tree('.', ['.'])])])])])])])])])]), Tree('NP', [Tree('NNP', ['India'])]), Tree('VP', [Tree('VBD', ['said']), Tree('SBAR', [Tree('IN', ['that']), Tree('S', [Tree('NP', [Tree('PRP', ['it'])]), Tree('VP', [Tree('VP', [Tree('VBD', ['lost']), Tree('ADVP', [Tree('RB', ['only']), Tree('NP', [Tree('CD', ['one']), Tree('NNS', ['MiG-21'])])]), Tree('NP', [Tree('NNP', ['Bison'])])]), Tree('CC', ['and']), Tree('VP', [Tree('VBD', ['had']), Tree('VP', [Tree('VBN', ['shot']), Tree('PRT', [Tree('RP', ['down'])]), Tree('NP', [Tree('CD', ['one']), Tree('JJ', ['Pakistani']), Tree('NN', ['F-16']), Tree('NN', ['jet'])])])])])])])])])])]), Tree('.', ['.'])])])]"
"War averted because of timely, correct decisions: Pakistan PM","Pakistan PM Imran Khan has said that tensions with India have eased and added that it was because of ""timely and correct decisions"" that war was averted. Khan reportedly said the crackdown against terror organisations was not made under any pressure. His comments came as he addressed a meeting of the PTI parliamentary party on Wednesday.",world,"War averted because of timely, correct decisions: Pakistan PM. Pakistan PM Imran Khan has said that tensions with India have eased and added that it was because of ""timely and correct decisions"" that war was averted. Khan reportedly said the crackdown against terror organisations was not made under any pressure. His comments came as he addressed a meeting of the PTI parliamentary party on Wednesday.",war avert timely correct decision pakistan pm pakistan pm imran khan say tension india ease add timely correct decision war avert khan reportedly say crackdown terror organisation not make pressure comment come address meeting pti parliamentary party wednesday,"[Tree('ROOT', [Tree('S', [Tree('NP', [Tree('NP', [Tree('NNP', ['War'])]), Tree('VP', [Tree('VBN', ['averted']), Tree('SBAR', [Tree('IN', ['because']), Tree('FRAG', [Tree('PP', [Tree('IN', ['of']), Tree('NP', [Tree('JJ', ['timely']), Tree(',', [',']), Tree('JJ', ['correct']), Tree('NNS', ['decisions'])])]), Tree(':', [':']), Tree('S', [Tree('NP', [Tree('NNP', ['Pakistan']), Tree('NNP', ['PM']), Tree('.', ['.']), Tree('NNP', ['Pakistan']), Tree('NNP', ['PM']), Tree('NNP', ['Imran']), Tree('NNP', ['Khan'])]), Tree('VP', [Tree('VP', [Tree('VBZ', ['has']), Tree('VP', [Tree('VBN', ['said']), Tree('SBAR', [Tree('IN', ['that']), Tree('S', [Tree('NP', [Tree('NP', [Tree('NNS', ['tensions'])]), Tree('PP', [Tree('IN', ['with']), Tree('NP', [Tree('NNP', ['India'])])])]), Tree('VP', [Tree('VBP', ['have']), Tree('VP', [Tree('VBN', ['eased'])])])])])])]), Tree('CC', ['and']), Tree('VP', [Tree('VBD', ['added']), Tree('SBAR', [Tree('IN', ['that']), Tree('S', [Tree('NP', [Tree('PRP', ['it'])]), Tree('VP', [Tree('VBD', ['was']), Tree('NP', [Tree('NP', [Tree('RB', ['because'])]), Tree('PP', [Tree('IN', ['of']), Tree('``', ['``']), Tree('NP', [Tree('ADJP', [Tree('JJ', ['timely']), Tree('CC', ['and']), Tree('JJ', ['correct'])]), Tree('NNS', ['decisions'])]), Tree(""''"", [""''""])]), Tree('SBAR', [Tree('WHNP', [Tree('WDT', ['that']), Tree('NN', ['war'])]), Tree('S', [Tree('VP', [Tree('VBD', ['was']), Tree('VP', [Tree('VBN', ['averted'])])])])])])])])])])])]), Tree('.', ['.'])])])])]), Tree('PRN', [Tree('S', [Tree('NP', [Tree('NNP', ['Khan'])]), Tree('ADVP', [Tree('RB', ['reportedly'])]), Tree('VP', [Tree('VBD', ['said']), Tree('SBAR', [Tree('S', [Tree('NP', [Tree('NP', [Tree('DT', ['the']), Tree('NN', ['crackdown'])]), Tree('PP', [Tree('IN', ['against']), Tree('NP', [Tree('NN', ['terror']), Tree('NNS', ['organisations'])])])]), Tree('VP', [Tree('VBD', ['was']), Tree('RB', ['not']), Tree('VP', [Tree('VBN', ['made']), Tree('PP', [Tree('IN', ['under']), Tree('NP', [Tree('DT', ['any']), Tree('NN', ['pressure'])])])])])])])]), Tree('.', ['.'])])]), Tree('NP', [Tree('PRP$', ['His']), Tree('NNS', ['comments'])]), Tree('VP', [Tree('VBD', ['came']), Tree('SBAR', [Tree('IN', ['as']), Tree('S', [Tree('NP', [Tree('PRP', ['he'])]), Tree('VP', [Tree('VBD', ['addressed']), Tree('NP', [Tree('NP', [Tree('DT', ['a']), Tree('NN', ['meeting'])]), Tree('PP', [Tree('IN', ['of']), Tree('NP', [Tree('DT', ['the']), Tree('NNP', ['PTI']), Tree('JJ', ['parliamentary']), Tree('NN', ['party'])])])]), Tree('PP', [Tree('IN', ['on']), Tree('NP', [Tree('NNP', ['Wednesday'])])])])])])]), Tree('.', ['.'])])])]"
Donald Trump mistakenly calls Apple CEO Tim Cook 'Tim Apple',"US President Donald Trump mistakenly called Apple CEO Tim Cook 'Tim Apple' at a conference in the White House. In videos that surfaced online, Tim Cook, who is sitting next to Trump, can be seen nodding after Trump's mistake. ""You have really put a big investment in our country. We really appreciate it very much, Tim Apple,"" Trump said.",world,"Donald Trump mistakenly calls Apple CEO Tim Cook 'Tim Apple'. US President Donald Trump mistakenly called Apple CEO Tim Cook 'Tim Apple' at a conference in the White House. In videos that surfaced online, Tim Cook, who is sitting next to Trump, can be seen nodding after Trump's mistake. ""You have really put a big investment in our country. We really appreciate it very much, Tim Apple,"" Trump said.",donald trump mistakenly call apple ceo tim cook tim apple us president donald trump mistakenly call apple ceo tim cook tim apple conference white house video surface online tim cook sit next trump see nod trump mistake really put big investment country really appreciate much tim apple trump say,"[Tree('ROOT', [Tree('S', [Tree('SBAR', [Tree('X', [Tree('NP', [Tree('NP', [Tree('NNP', ['Donald']), Tree('NNP', ['Trump'])]), Tree('NP', [Tree('JJ', ['mistakenly']), Tree('NNS', ['calls'])])]), Tree('NP', [Tree('NP', [Tree('NNP', ['Apple']), Tree('NNP', ['CEO']), Tree('NNP', ['Tim'])]), Tree('NP', [Tree('NNP', ['Cook']), Tree('``', ['`']), Tree('NNP', ['Tim']), Tree('NNP', ['Apple']), Tree(""''"", [""'""])])]), Tree('.', ['.'])]), Tree('S', [Tree('NP', [Tree('NNP', ['US']), Tree('NNP', ['President']), Tree('NNP', ['Donald']), Tree('NNP', ['Trump'])]), Tree('ADVP', [Tree('RB', ['mistakenly'])]), Tree('VP', [Tree('VBD', ['called']), Tree('NP', [Tree('NP', [Tree('NNP', ['Apple']), Tree('NNP', ['CEO']), Tree('NNP', ['Tim']), Tree('NNP', ['Cook'])]), Tree('``', ['`']), Tree('NP', [Tree('NNP', ['Tim']), Tree('NNP', ['Apple'])]), Tree(""''"", [""'""])]), Tree('PP', [Tree('IN', ['at']), Tree('NP', [Tree('NP', [Tree('DT', ['a']), Tree('NN', ['conference'])]), Tree('PP', [Tree('IN', ['in']), Tree('NP', [Tree('DT', ['the']), Tree('NNP', ['White']), Tree('NNP', ['House']), Tree('.', ['.'])])])])]), Tree('SBAR', [Tree('S', [Tree('PP', [Tree('IN', ['In']), Tree('NP', [Tree('NP', [Tree('NNS', ['videos'])]), Tree('SBAR', [Tree('IN', ['that']), Tree('SINV', [Tree('VP', [Tree('VBD', ['surfaced']), Tree('SBAR', [Tree('S', [Tree('NP', [Tree('NP', [Tree('JJ', ['online'])]), Tree(',', [',']), Tree('NP', [Tree('NNP', ['Tim']), Tree('NNP', ['Cook'])]), Tree(',', [',']), Tree('SBAR', [Tree('WHNP', [Tree('WP', ['who'])]), Tree('S', [Tree('VP', [Tree('VBZ', ['is']), Tree('VP', [Tree('VBG', ['sitting']), Tree('ADVP', [Tree('JJ', ['next'])]), Tree('PP', [Tree('TO', ['to']), Tree('NP', [Tree('NNP', ['Trump'])])])])])])]), Tree(',', [','])]), Tree('VP', [Tree('MD', ['can']), Tree('VP', [Tree('VB', ['be']), Tree('VP', [Tree('VBN', ['seen']), Tree('S', [Tree('VP', [Tree('VBG', ['nodding']), Tree('PP', [Tree('IN', ['after'])])])])])])])])])]), Tree('NP', [Tree('NP', [Tree('NNP', ['Trump']), Tree('POS', [""'s""])]), Tree('NN', ['mistake'])]), Tree('.', ['.']), Tree('``', ['``']), Tree('S', [Tree('NP', [Tree('PRP', ['You'])]), Tree('VP', [Tree('VBP', ['have']), Tree('ADVP', [Tree('RB', ['really'])]), Tree('VP', [Tree('VBN', ['put']), Tree('NP', [Tree('NP', [Tree('DT', ['a']), Tree('JJ', ['big']), Tree('NN', ['investment'])]), Tree('PP', [Tree('IN', ['in']), Tree('NP', [Tree('PRP$', ['our']), Tree('NN', ['country'])])])])])])]), Tree('.', ['.'])])])])]), Tree('NP', [Tree('PRP', ['We'])]), Tree('VP', [Tree('ADVP', [Tree('RB', ['really'])]), Tree('VBP', ['appreciate']), Tree('NP', [Tree('PRP', ['it'])]), Tree('ADVP', [Tree('RB', ['very']), Tree('RB', ['much'])])])])])])])]), Tree(',', [',']), Tree('NP', [Tree('NNP', ['Tim']), Tree('NNP', ['Apple'])]), Tree(',', [',']), Tree(""''"", [""''""]), Tree('NP', [Tree('NNP', ['Trump'])]), Tree('VP', [Tree('VBD', ['said'])]), Tree('.', ['.'])])])]"
"Pak claims to take over 182 madrasas in terror crackdown, detain 121","Pakistan has taken control of 182 madrasas (religious schools) and detained 121 people in a crackdown on banned militant organisations, the country's interior ministry said on Thursday. The ministry had detained 44 people, including Jaish-e-Mohammed chief Masood Azhar's brother Mufti Abdul Rauf by Tuesday. This comes days after Jaish-e-Mohammed carried out a suicide attack on CRPF jawans in J&K's Pulwama.  ",world,"Pak claims to take over 182 madrasas in terror crackdown, detain 121. Pakistan has taken control of 182 madrasas (religious schools) and detained 121 people in a crackdown on banned militant organisations, the country's interior ministry said on Thursday. The ministry had detained 44 people, including Jaish-e-Mohammed chief Masood Azhar's brother Mufti Abdul Rauf by Tuesday. This comes days after Jaish-e-Mohammed carried out a suicide attack on CRPF jawans in J&K's Pulwama.  ",pak claim take 182 madrasa terror crackdown detain 121 pakistan take control 182 madrasa religious school detain 121 people crackdown ban militant organisation country interior ministry say thursday ministry detain 44 people include jaish e mohammed chief masood azhar brother mufti abdul rauf tuesday come day jaish e mohammed carry suicide attack crpf jawan jks pulwama,"[Tree('ROOT', [Tree('S', [Tree('S', [Tree('NP', [Tree('NNP', ['Pak'])]), Tree('VP', [Tree('VBZ', ['claims']), Tree('S', [Tree('VP', [Tree('TO', ['to']), Tree('VP', [Tree('VB', ['take']), Tree('NP', [Tree('NP', [Tree('QP', [Tree('IN', ['over']), Tree('CD', ['182'])]), Tree('NNS', ['madrasas'])]), Tree('PP', [Tree('IN', ['in']), Tree('NP', [Tree('NN', ['terror']), Tree('NN', ['crackdown'])])])])])])])])]), Tree(',', [',']), Tree('S', [Tree('NP', [Tree('NN', ['detain']), Tree('NNP', ['121']), Tree('.', ['.']), Tree('NNP', ['Pakistan'])]), Tree('VP', [Tree('VBZ', ['has']), Tree('VP', [Tree('VBN', ['taken']), Tree('NP', [Tree('NP', [Tree('NN', ['control'])]), Tree('PP', [Tree('IN', ['of']), Tree('NP', [Tree('NP', [Tree('NP', [Tree('JJ', ['182']), Tree('NNS', ['madrasas'])]), Tree('PRN', [Tree('-LRB-', ['-LRB-']), Tree('NP', [Tree('JJ', ['religious']), Tree('NNS', ['schools'])]), Tree('-RRB-', ['-RRB-'])])]), Tree('CC', ['and']), Tree('NP', [Tree('QP', [Tree('CD', ['detained']), Tree('CD', ['121'])]), Tree('NNS', ['people'])])])])]), Tree('PP', [Tree('IN', ['in']), Tree('NP', [Tree('NP', [Tree('DT', ['a']), Tree('NN', ['crackdown'])]), Tree('PP', [Tree('IN', ['on']), Tree('NP', [Tree('VBN', ['banned']), Tree('JJ', ['militant']), Tree('NNS', ['organisations'])])])])])])])]), Tree(',', [',']), Tree('S', [Tree('NP', [Tree('NP', [Tree('DT', ['the']), Tree('NN', ['country']), Tree('POS', [""'s""])]), Tree('JJ', ['interior']), Tree('NN', ['ministry'])]), Tree('VP', [Tree('VBD', ['said']), Tree('PRT', [Tree('RP', ['on'])]), Tree('NP', [Tree('NP', [Tree('NNP', ['Thursday']), Tree('.', ['.'])]), Tree('SBAR', [Tree('S', [Tree('NP', [Tree('DT', ['The']), Tree('NN', ['ministry'])]), Tree('VP', [Tree('VBD', ['had']), Tree('VP', [Tree('VBN', ['detained']), Tree('NP', [Tree('NP', [Tree('CD', ['44']), Tree('NNS', ['people'])]), Tree(',', [',']), Tree('PP', [Tree('VBG', ['including']), Tree('NP', [Tree('NP', [Tree('JJ', ['Jaish-e-Mohammed']), Tree('NN', ['chief']), Tree('NNP', ['Masood']), Tree('NNP', ['Azhar']), Tree('POS', [""'s""])]), Tree('NN', ['brother']), Tree('NNP', ['Mufti']), Tree('NNP', ['Abdul']), Tree('NNP', ['Rauf'])])])])])])])])]), Tree('PP', [Tree('IN', ['by']), Tree('NP', [Tree('NP', [Tree('NNP', ['Tuesday']), Tree('.', ['.'])]), Tree('SBAR', [Tree('S', [Tree('NP', [Tree('DT', ['This'])]), Tree('VP', [Tree('VBZ', ['comes']), Tree('NP', [Tree('NNS', ['days'])]), Tree('SBAR', [Tree('IN', ['after']), Tree('S', [Tree('NP', [Tree('NNP', ['Jaish-e-Mohammed'])]), Tree('VP', [Tree('VBD', ['carried']), Tree('PRT', [Tree('RP', ['out'])]), Tree('NP', [Tree('DT', ['a']), Tree('NN', ['suicide']), Tree('NN', ['attack'])]), Tree('PP', [Tree('IN', ['on']), Tree('NP', [Tree('NNP', ['CRPF']), Tree('NNS', ['jawans'])])]), Tree('PP', [Tree('IN', ['in']), Tree('NP', [Tree('NP', [Tree('NNP', ['J&K']), Tree('POS', [""'s""])]), Tree('NNP', ['Pulwama'])])])])])])])])])])])])]), Tree('.', ['.'])])])]"
"Ex-lover, suspect in Indian-origin dentist murder, dies in BMW crash","The key suspect in the murder of a 32-year-old Indian-origin woman dentist in Australia's Sydney died in a BMW car crash on Monday. The dentist's body was found in a suitcase on Tuesday, two days after she went missing. Police had questioned her ex-boyfriend over the missing report after he travelled 400 kilometres to attend a dental conference with her.",world,"Ex-lover, suspect in Indian-origin dentist murder, dies in BMW crash. The key suspect in the murder of a 32-year-old Indian-origin woman dentist in Australia's Sydney died in a BMW car crash on Monday. The dentist's body was found in a suitcase on Tuesday, two days after she went missing. Police had questioned her ex-boyfriend over the missing report after he travelled 400 kilometres to attend a dental conference with her.",ex lover suspect indian origin dentist murder die bmw crash key suspect murder 32year old indian origin woman dentist australias sydney die bmw car crash monday dentist body find suitcase tuesday two day go miss police question ex boyfriend missing report travel 400 kilometre attend dental conference,"[Tree('ROOT', [Tree('S', [Tree('NP', [Tree('NP', [Tree('NN', ['Ex-lover'])]), Tree(',', [',']), Tree('NP', [Tree('NP', [Tree('ADJP', [Tree('JJ', ['suspect']), Tree('PP', [Tree('IN', ['in']), Tree('NP', [Tree('NP', [Tree('JJ', ['Indian-origin']), Tree('NN', ['dentist']), Tree('NN', ['murder'])]), Tree(',', [',']), Tree('VP', [Tree('VBZ', ['dies']), Tree('PP', [Tree('IN', ['in']), Tree('NP', [Tree('NNP', ['BMW'])])])])])])]), Tree('NN', ['crash'])]), Tree('.', ['.']), Tree('NP', [Tree('NP', [Tree('DT', ['The']), Tree('JJ', ['key']), Tree('NN', ['suspect'])]), Tree('PP', [Tree('IN', ['in']), Tree('NP', [Tree('NP', [Tree('DT', ['the']), Tree('NN', ['murder'])]), Tree('PP', [Tree('IN', ['of']), Tree('NP', [Tree('NP', [Tree('DT', ['a']), Tree('JJ', ['32-year-old']), Tree('JJ', ['Indian-origin']), Tree('NN', ['woman']), Tree('NN', ['dentist'])]), Tree('PP', [Tree('IN', ['in']), Tree('NP', [Tree('NP', [Tree('NNP', ['Australia']), Tree('POS', [""'s""])]), Tree('NNP', ['Sydney'])])])])])])])])])]), Tree('VP', [Tree('VBD', ['died']), Tree('PP', [Tree('IN', ['in']), Tree('NP', [Tree('DT', ['a']), Tree('NNP', ['BMW']), Tree('NN', ['car']), Tree('NN', ['crash'])])]), Tree('PP', [Tree('IN', ['on']), Tree('NP', [Tree('NP', [Tree('NNP', ['Monday']), Tree('.', ['.'])]), Tree('SBAR', [Tree('S', [Tree('NP', [Tree('NP', [Tree('DT', ['The']), Tree('NN', ['dentist']), Tree('POS', [""'s""])]), Tree('NN', ['body'])]), Tree('VP', [Tree('VBD', ['was']), Tree('VP', [Tree('VBN', ['found']), Tree('PP', [Tree('IN', ['in']), Tree('NP', [Tree('NP', [Tree('DT', ['a']), Tree('NN', ['suitcase'])]), Tree('PP', [Tree('IN', ['on']), Tree('NP', [Tree('NNP', ['Tuesday'])])])])]), Tree(',', [',']), Tree('SBAR', [Tree('NP', [Tree('CD', ['two']), Tree('NNS', ['days'])]), Tree('IN', ['after']), Tree('S', [Tree('NP', [Tree('PRP', ['she'])]), Tree('VP', [Tree('VBD', ['went']), Tree('SBAR', [Tree('S', [Tree('NP', [Tree('NNP', ['missing']), Tree('.', ['.']), Tree('NNP', ['Police'])]), Tree('VP', [Tree('VBD', ['had']), Tree('VP', [Tree('VBN', ['questioned']), Tree('NP', [Tree('PRP$', ['her']), Tree('NN', ['ex-boyfriend'])]), Tree('PP', [Tree('IN', ['over']), Tree('NP', [Tree('DT', ['the']), Tree('VBG', ['missing']), Tree('NN', ['report'])])])])])])])])])]), Tree('SBAR', [Tree('IN', ['after']), Tree('S', [Tree('NP', [Tree('PRP', ['he'])]), Tree('VP', [Tree('VBD', ['travelled']), Tree('NP', [Tree('CD', ['400']), Tree('NNS', ['kilometres'])]), Tree('S', [Tree('VP', [Tree('TO', ['to']), Tree('VP', [Tree('VB', ['attend']), Tree('NP', [Tree('DT', ['a']), Tree('JJ', ['dental']), Tree('NN', ['conference'])]), Tree('PP', [Tree('IN', ['with']), Tree('NP', [Tree('PRP', ['her'])])])])])])])])])])])])])])])]), Tree('.', ['.'])])])]"
