news_headline,news_article,news_category,full_text,clean_text,stanford_text
"Player celebrates goal by climbing ladder, changing scorecard","During a second division match in Guatemala, Deportivo Carcha's Luis Acuna opened the scoring against Deportivo Jocotan and celebrated the goal by climbing a ladder to change the scoreboard. The Argentina-born midfielder converted a penalty in the 80th minute and did the celebration before being booked by the referee. Deportivo Carcha went on to win the match 1-0.",sports,"Player celebrates goal by climbing ladder, changing scorecard. During a second division match in Guatemala, Deportivo Carcha's Luis Acuna opened the scoring against Deportivo Jocotan and celebrated the goal by climbing a ladder to change the scoreboard. The Argentina-born midfielder converted a penalty in the 80th minute and did the celebration before being booked by the referee. Deportivo Carcha went on to win the match 1-0.",player celebrate goal climb ladder change scorecard second division match guatemala deportivo carcha luis acuna open scoring deportivo jocotan celebrate goal climb ladder change scoreboard argentina bear midfielder convert penalty 80th minute celebration book referee deportivo carcha go win match 1 0,"[Tree('ROOT', [Tree('S', [Tree('NP', [Tree('NNP', ['Player'])]), Tree('VP', [Tree('VBZ', ['celebrates']), Tree('NP', [Tree('NN', ['goal'])]), Tree('PP', [Tree('IN', ['by']), Tree('S', [Tree('VP', [Tree('VBG', ['climbing']), Tree('NP', [Tree('NN', ['ladder'])])])])]), Tree(',', [',']), Tree('S', [Tree('VP', [Tree('VBG', ['changing']), Tree('NP', [Tree('NP', [Tree('NNP', ['scorecard']), Tree('.', ['.'])]), Tree('SBAR', [Tree('S', [Tree('PP', [Tree('IN', ['During']), Tree('NP', [Tree('NP', [Tree('DT', ['a']), Tree('JJ', ['second']), Tree('NN', ['division']), Tree('NN', ['match'])]), Tree('PP', [Tree('IN', ['in']), Tree('NP', [Tree('NNP', ['Guatemala'])])])])]), Tree(',', [',']), Tree('NP', [Tree('NP', [Tree('NNP', ['Deportivo']), Tree('NNP', ['Carcha']), Tree('POS', [""'s""])]), Tree('NNP', ['Luis']), Tree('NNP', ['Acuna'])]), Tree('VP', [Tree('VP', [Tree('VBD', ['opened']), Tree('NP', [Tree('DT', ['the']), Tree('VBG', ['scoring'])]), Tree('PP', [Tree('IN', ['against']), Tree('NP', [Tree('NNP', ['Deportivo']), Tree('NNP', ['Jocotan'])])])]), Tree('CC', ['and']), Tree('VP', [Tree('VBD', ['celebrated']), Tree('NP', [Tree('DT', ['the']), Tree('NN', ['goal'])]), Tree('PP', [Tree('IN', ['by']), Tree('S', [Tree('VP', [Tree('VBG', ['climbing']), Tree('NP', [Tree('DT', ['a']), Tree('NN', ['ladder']), Tree('S', [Tree('VP', [Tree('TO', ['to']), Tree('VP', [Tree('VB', ['change']), Tree('S', [Tree('SBAR', [Tree('X', [Tree('DT', ['the']), Tree('ADJP', [Tree('JJ', ['scoreboard']), Tree('.', ['.'])])]), Tree('S', [Tree('NP', [Tree('DT', ['The']), Tree('JJ', ['Argentina-born']), Tree('NN', ['midfielder'])]), Tree('VP', [Tree('VP', [Tree('VBD', ['converted']), Tree('NP', [Tree('DT', ['a']), Tree('NN', ['penalty'])]), Tree('PP', [Tree('IN', ['in']), Tree('NP', [Tree('DT', ['the']), Tree('JJ', ['80th']), Tree('NN', ['minute'])])])]), Tree('CC', ['and']), Tree('VP', [Tree('VBD', ['did']), Tree('NP', [Tree('DT', ['the']), Tree('NN', ['celebration'])]), Tree('PP', [Tree('IN', ['before']), Tree('S', [Tree('VP', [Tree('VBG', ['being']), Tree('VP', [Tree('VBN', ['booked']), Tree('PP', [Tree('IN', ['by']), Tree('NP', [Tree('DT', ['the']), Tree('NN', ['referee'])])]), Tree('.', ['.'])])])])])])])])]), Tree('NP', [Tree('NNP', ['Deportivo']), Tree('NNP', ['Carcha'])]), Tree('VP', [Tree('VBD', ['went']), Tree('PRT', [Tree('RP', ['on'])]), Tree('S', [Tree('VP', [Tree('TO', ['to']), Tree('VP', [Tree('VB', ['win']), Tree('NP', [Tree('DT', ['the']), Tree('NN', ['match']), Tree('NN', ['1-0'])])])])])])])])])])])])])])])])])])])])])]), Tree('.', ['.'])])])]"
"Ritu Phogat shares pic while training for MMA, dedicates post to dad","Indian wrestlers Geeta and Babita Phogat's sister Ritu, who recently left wrestling for MMA, took to Twitter to share her picture while training and dedicated the post to her father. ""My dad once said, 'Main Apni Choriyo Ko Itna Qabil Banaonga Ke Choray Unhai Daikhne Nahi...Wo Choro Ko Daikhnai Jawaynge' #DangalGirls #girlpower #daddy #prouddaughter #thankyou,"" she wrote.",sports,"Ritu Phogat shares pic while training for MMA, dedicates post to dad. Indian wrestlers Geeta and Babita Phogat's sister Ritu, who recently left wrestling for MMA, took to Twitter to share her picture while training and dedicated the post to her father. ""My dad once said, 'Main Apni Choriyo Ko Itna Qabil Banaonga Ke Choray Unhai Daikhne Nahi...Wo Choro Ko Daikhnai Jawaynge' #DangalGirls #girlpower #daddy #prouddaughter #thankyou,"" she wrote.",ritu phogat share pic train mma dedicate post dad indian wrestler geeta babita phogat sister ritu recently leave wrestling mma take twitter share picture training dedicate post father dad say main apni choriyo ko itna qabil banaonga ke choray unhai daikhne nahi wo choro ko daikhnai jawaynge dangalgirl girlpower daddy prouddaughter thankyou write,"[Tree('ROOT', [Tree('S', [Tree('S', [Tree('NP', [Tree('NP', [Tree('NNP', ['Ritu']), Tree('NNP', ['Phogat']), Tree('NNS', ['shares']), Tree('NN', ['pic'])]), Tree('SBAR', [Tree('IN', ['while']), Tree('SINV', [Tree('S', [Tree('VP', [Tree('VBG', ['training']), Tree('PP', [Tree('IN', ['for']), Tree('NP', [Tree('NNP', ['MMA'])])])])]), Tree(',', [',']), Tree('VP', [Tree('VBZ', ['dedicates']), Tree('NP', [Tree('NN', ['post'])]), Tree('PP', [Tree('TO', ['to']), Tree('NP', [Tree('NP', [Tree('NNP', ['dad']), Tree('.', ['.']), Tree('NNP', ['Indian']), Tree('FW', ['wrestlers']), Tree('NNP', ['Geeta'])]), Tree('CC', ['and']), Tree('NP', [Tree('NP', [Tree('NNP', ['Babita']), Tree('NNP', ['Phogat']), Tree('POS', [""'s""])]), Tree('NN', ['sister'])])])])]), Tree('NP', [Tree('NP', [Tree('NNP', ['Ritu'])]), Tree(',', [',']), Tree('SBAR', [Tree('WHNP', [Tree('WP', ['who'])]), Tree('S', [Tree('ADVP', [Tree('RB', ['recently'])]), Tree('VP', [Tree('VP', [Tree('VBD', ['left']), Tree('S', [Tree('VP', [Tree('VBG', ['wrestling']), Tree('PP', [Tree('IN', ['for']), Tree('NP', [Tree('NNP', ['MMA'])])])])])]), Tree(',', [',']), Tree('VP', [Tree('VBD', ['took']), Tree('S', [Tree('VP', [Tree('TO', ['to']), Tree('VP', [Tree('VB', ['Twitter']), Tree('S', [Tree('VP', [Tree('TO', ['to']), Tree('VP', [Tree('VB', ['share']), Tree('NP', [Tree('PRP$', ['her']), Tree('NN', ['picture']), Tree('NN', ['while']), Tree('NN', ['training'])])])])])])])])]), Tree('CC', ['and']), Tree('VP', [Tree('VBD', ['dedicated']), Tree('NP', [Tree('DT', ['the']), Tree('NN', ['post'])]), Tree('PP', [Tree('TO', ['to']), Tree('NP', [Tree('PRP$', ['her']), Tree('NN', ['father'])])])])])])])]), Tree('.', ['.'])])])]), Tree('``', ['``']), Tree('NP', [Tree('PRP$', ['My']), Tree('NN', ['dad'])]), Tree('ADVP', [Tree('RB', ['once'])]), Tree('VP', [Tree('VBD', ['said']), Tree(',', [',']), Tree('``', ['`']), Tree('S', [Tree('NP', [Tree('NNP', ['Main']), Tree('NNP', ['Apni']), Tree('NNP', ['Choriyo']), Tree('NNP', ['Ko']), Tree('NNP', ['Itna']), Tree('NNP', ['Qabil']), Tree('NNP', ['Banaonga']), Tree('NNP', ['Ke']), Tree('NNP', ['Choray']), Tree('NNP', ['Unhai']), Tree('NNP', ['Daikhne']), Tree('NNP', ['Nahi'])]), Tree(':', ['...']), Tree('VP', [Tree('VBG', ['Wo']), Tree('S', [Tree('NP', [Tree('NP', [Tree('NNP', ['Choro']), Tree('NNP', ['Ko']), Tree('NNP', ['Daikhnai']), Tree('NNP', ['Jawaynge']), Tree('POS', [""'""])]), Tree('NNS', ['#DangalGirls']), Tree('NN', ['#girlpower']), Tree('JJ', ['#daddy']), Tree('NN', ['#prouddaughter'])]), Tree('ADJP', [Tree('JJ', ['#thankyou'])])])])])])]), Tree(',', [',']), Tree(""''"", [""''""]), Tree('NP', [Tree('PRP', ['she'])]), Tree('VP', [Tree('VBD', ['wrote'])]), Tree('.', ['.'])])])]"
Still seeking international ban on Pak despite ICC snub: COA chief,"Committee of Administrators (CoA) chairman Vinod Rai has said that the BCCI is still seeking a ban on Pakistan despite the ICC saying it was not their domain to sever ties with nations harbouring terrorism. ""Let the time come. [World Cup] is still four months away,"" Rai added. ""It is a process which goes slow,"" he added.",sports,"Still seeking international ban on Pak despite ICC snub: COA chief. Committee of Administrators (CoA) chairman Vinod Rai has said that the BCCI is still seeking a ban on Pakistan despite the ICC saying it was not their domain to sever ties with nations harbouring terrorism. ""Let the time come. [World Cup] is still four months away,"" Rai added. ""It is a process which goes slow,"" he added.",still seek international ban pak despite icc snub coa chief committee administrator coa chairman vinod rai say bcci still seek ban pakistan despite icc say not domain sever tie nation harbour terrorism let time come [ world cup ] still four month away rai add process go slow add,"[Tree('ROOT', [Tree('S', [Tree('ADVP', [Tree('RB', ['Still'])]), Tree('S', [Tree('S', [Tree('VP', [Tree('VBG', ['seeking']), Tree('NP', [Tree('JJ', ['international']), Tree('NN', ['ban'])]), Tree('PP', [Tree('IN', ['on']), Tree('NP', [Tree('NNP', ['Pak'])])]), Tree('PP', [Tree('IN', ['despite']), Tree('NP', [Tree('NNP', ['ICC'])])])])]), Tree('VP', [Tree('VBZ', ['snub'])])]), Tree(':', [':']), Tree('S', [Tree('SBAR', [Tree('X', [Tree('X', [Tree('ADVP', [Tree('RB', ['COA'])]), Tree('NP', [Tree('NN', ['chief'])]), Tree('.', ['.'])]), Tree('NP', [Tree('NP', [Tree('NNP', ['Committee'])]), Tree('PP', [Tree('IN', ['of']), Tree('NP', [Tree('NNP', ['Administrators']), Tree('PRN', [Tree('-LRB-', ['-LRB-']), Tree('NP', [Tree('NNP', ['CoA'])]), Tree('-RRB-', ['-RRB-'])]), Tree('NN', ['chairman'])])])])]), Tree('S', [Tree('NP', [Tree('NNP', ['Vinod']), Tree('NNP', ['Rai'])]), Tree('VP', [Tree('VBZ', ['has']), Tree('VP', [Tree('VBN', ['said']), Tree('SBAR', [Tree('IN', ['that']), Tree('S', [Tree('NP', [Tree('DT', ['the']), Tree('NNP', ['BCCI'])]), Tree('VP', [Tree('VBZ', ['is']), Tree('ADVP', [Tree('RB', ['still'])]), Tree('VP', [Tree('VBG', ['seeking']), Tree('NP', [Tree('NP', [Tree('DT', ['a']), Tree('NN', ['ban'])]), Tree('PP', [Tree('IN', ['on']), Tree('NP', [Tree('NP', [Tree('NNP', ['Pakistan']), Tree('IN', ['despite']), Tree('DT', ['the']), Tree('NNP', ['ICC'])]), Tree('VP', [Tree('VBG', ['saying']), Tree('SBAR', [Tree('S', [Tree('NP', [Tree('PRP', ['it'])]), Tree('VP', [Tree('VBD', ['was']), Tree('RB', ['not']), Tree('NP', [Tree('PRP$', ['their']), Tree('NN', ['domain']), Tree('S', [Tree('VP', [Tree('TO', ['to']), Tree('VP', [Tree('VB', ['sever']), Tree('NP', [Tree('NNS', ['ties'])]), Tree('PP', [Tree('IN', ['with']), Tree('NP', [Tree('NNS', ['nations'])])])])])])])])])])])])])]), Tree('FRAG', [Tree('NP', [Tree('JJ', ['harbouring']), Tree('NN', ['terrorism']), Tree('.', ['.'])]), Tree('S', [Tree('VP', [Tree('``', ['``']), Tree('VB', ['Let']), Tree('S', [Tree('NP', [Tree('DT', ['the']), Tree('NN', ['time'])]), Tree('VP', [Tree('VB', ['come'])])])])]), Tree('.', ['.'])])])])])])])])])]), Tree('NP', [Tree('NNP', ['-LSB-']), Tree('NNP', ['World']), Tree('NNP', ['Cup']), Tree('NNP', ['-RSB-'])]), Tree('VP', [Tree('VBZ', ['is']), Tree('ADVP', [Tree('RB', ['still'])]), Tree('ADVP', [Tree('NP', [Tree('CD', ['four']), Tree('NNS', ['months'])]), Tree('RB', ['away'])])])]), Tree(',', [',']), Tree(""''"", [""''""]), Tree('S', [Tree('NP', [Tree('NNP', ['Rai'])]), Tree('VP', [Tree('VBD', ['added'])])]), Tree('.', ['.']), Tree('``', ['``']), Tree('S', [Tree('S', [Tree('NP', [Tree('PRP', ['It'])]), Tree('VP', [Tree('VBZ', ['is']), Tree('NP', [Tree('NP', [Tree('DT', ['a']), Tree('NN', ['process'])]), Tree('SBAR', [Tree('WHNP', [Tree('WDT', ['which'])]), Tree('S', [Tree('VP', [Tree('VBZ', ['goes']), Tree('ADJP', [Tree('JJ', ['slow'])])])])])])])]), Tree(',', [',']), Tree(""''"", [""''""]), Tree('NP', [Tree('PRP', ['he'])]), Tree('VP', [Tree('VBD', ['added'])])]), Tree('.', ['.'])])])]"
"SA's Miller attempts quick stumping, Du Plessis calls him 'MS Dhoni'","During Sri Lanka's 32nd over in the second ODI against South Africa, South Africa batsman David Miller attempted a quick stumping off Imran Tahir when regular wicketkeeper Quinton de Kock had left the field. Miller quickly dislodged the bails after Vishwa Fernando missed a shot, after which South Africa captain Faf du Plessis termed Miller as 'MS Dhoni'.",sports,"SA's Miller attempts quick stumping, Du Plessis calls him 'MS Dhoni'. During Sri Lanka's 32nd over in the second ODI against South Africa, South Africa batsman David Miller attempted a quick stumping off Imran Tahir when regular wicketkeeper Quinton de Kock had left the field. Miller quickly dislodged the bails after Vishwa Fernando missed a shot, after which South Africa captain Faf du Plessis termed Miller as 'MS Dhoni'.",sas miller attempt quick stumping du plessis call ms dhoni sri lankas 32nd second odi south africa south africa batsman david miller attempt quick stumping imran tahir regular wicketkeeper quinton de kock leave field miller quickly dislodge bail vishwa fernando miss shot south africa captain faf du plessis term miller ms dhoni,"[Tree('ROOT', [Tree('S', [Tree('NP', [Tree('NP', [Tree('NP', [Tree('NNP', ['SA']), Tree('POS', [""'s""])]), Tree('NNP', ['Miller']), Tree('NNS', ['attempts'])]), Tree('SBAR', [Tree('FRAG', [Tree('ADJP', [Tree('JJ', ['quick'])]), Tree('S', [Tree('S', [Tree('VP', [Tree('VBG', ['stumping'])])]), Tree(',', [',']), Tree('NP', [Tree('NNP', ['Du']), Tree('NNP', ['Plessis'])]), Tree('VP', [Tree('VBZ', ['calls']), Tree('S', [Tree('NP', [Tree('PRP', ['him'])]), Tree('``', ['`']), Tree('NP', [Tree('NNP', ['MS']), Tree('NNP', ['Dhoni'])]), Tree(""''"", [""'""])])])]), Tree('.', ['.'])])])]), Tree('PRN', [Tree('S', [Tree('PP', [Tree('IN', ['During']), Tree('NP', [Tree('NP', [Tree('NP', [Tree('NNP', ['Sri']), Tree('NNP', ['Lanka']), Tree('POS', [""'s""])]), Tree('NNS', ['32nd'])]), Tree('PP', [Tree('IN', ['over']), Tree('PP', [Tree('IN', ['in']), Tree('NP', [Tree('NP', [Tree('DT', ['the']), Tree('JJ', ['second']), Tree('NN', ['ODI'])]), Tree('PP', [Tree('IN', ['against']), Tree('NP', [Tree('NNP', ['South']), Tree('NNP', ['Africa'])])])])])])])]), Tree(',', [',']), Tree('NP', [Tree('NNP', ['South']), Tree('NNP', ['Africa']), Tree('NN', ['batsman']), Tree('NNP', ['David']), Tree('NNP', ['Miller'])]), Tree('VP', [Tree('VBD', ['attempted']), Tree('NP', [Tree('DT', ['a']), Tree('JJ', ['quick']), Tree('NN', ['stumping'])]), Tree('PP', [Tree('IN', ['off']), Tree('NP', [Tree('NNP', ['Imran']), Tree('NNP', ['Tahir'])])]), Tree('SBAR', [Tree('WHADVP', [Tree('WRB', ['when'])]), Tree('S', [Tree('NP', [Tree('JJ', ['regular']), Tree('NN', ['wicketkeeper']), Tree('NNP', ['Quinton']), Tree('FW', ['de']), Tree('NNP', ['Kock'])]), Tree('VP', [Tree('VBD', ['had']), Tree('VP', [Tree('VBN', ['left']), Tree('NP', [Tree('DT', ['the']), Tree('NN', ['field'])])])])])])]), Tree('.', ['.'])])]), Tree('NP', [Tree('NNP', ['Miller'])]), Tree('VP', [Tree('ADVP', [Tree('RB', ['quickly'])]), Tree('VBD', ['dislodged']), Tree('NP', [Tree('DT', ['the']), Tree('NNS', ['bails'])]), Tree('SBAR', [Tree('IN', ['after']), Tree('S', [Tree('NP', [Tree('NNP', ['Vishwa']), Tree('NNP', ['Fernando'])]), Tree('VP', [Tree('VBD', ['missed']), Tree('NP', [Tree('NP', [Tree('DT', ['a']), Tree('NN', ['shot'])]), Tree(',', [',']), Tree('SBAR', [Tree('WHPP', [Tree('IN', ['after']), Tree('WHNP', [Tree('WDT', ['which'])])]), Tree('S', [Tree('NP', [Tree('NNP', ['South']), Tree('NNP', ['Africa']), Tree('NN', ['captain']), Tree('NNP', ['Faf']), Tree('NNP', ['du']), Tree('NNP', ['Plessis'])]), Tree('VP', [Tree('VBD', ['termed']), Tree('NP', [Tree('NNP', ['Miller'])]), Tree('PP', [Tree('IN', ['as']), Tree('``', ['`']), Tree('NP', [Tree('NNP', ['MS']), Tree('NNP', ['Dhoni'])]), Tree(""''"", [""'""])])])])])])])])])]), Tree('.', ['.'])])])]"
23-yr-old Tushar to play Mumbai's next T20 despite mother's death,"Mumbai's 23-year-old fast bowler Tushar Deshpande will be playing for his team in Syed Mushtaq Ali Trophy on Friday in honour of his mother, who passed away of cancer on Tuesday. ""Thoughts about mummy will definitely come, but my mom wanted me to play well and nothing else. If I stop right now, then there's no point,"" Deshpande said.",sports,"23-yr-old Tushar to play Mumbai's next T20 despite mother's death. Mumbai's 23-year-old fast bowler Tushar Deshpande will be playing for his team in Syed Mushtaq Ali Trophy on Friday in honour of his mother, who passed away of cancer on Tuesday. ""Thoughts about mummy will definitely come, but my mom wanted me to play well and nothing else. If I stop right now, then there's no point,"" Deshpande said.",23yr old tushar play mumbai next t20 despite mother death mumbais 23year old fast bowler tushar deshpande play team syed mushtaq ali trophy friday honour mother pass away cancer tuesday thought mummy definitely come mom want play well nothing else stop right no point deshpande say,"[Tree('ROOT', [Tree('S', [Tree('S', [Tree('SBAR', [Tree('X', [Tree('NP', [Tree('NP', [Tree('JJ', ['23-yr-old']), Tree('NN', ['Tushar'])]), Tree('PP', [Tree('TO', ['to']), Tree('NP', [Tree('NN', ['play'])])])]), Tree('NP', [Tree('NP', [Tree('NP', [Tree('NNP', ['Mumbai']), Tree('POS', [""'s""])]), Tree('JJ', ['next']), Tree('NN', ['T20'])]), Tree('PP', [Tree('IN', ['despite']), Tree('NP', [Tree('NP', [Tree('NN', ['mother']), Tree('POS', [""'s""])]), Tree('NN', ['death'])])])]), Tree('.', ['.'])]), Tree('S', [Tree('S', [Tree('S', [Tree('NP', [Tree('NP', [Tree('NP', [Tree('NNP', ['Mumbai']), Tree('POS', [""'s""])]), Tree('JJ', ['23-year-old']), Tree('JJ', ['fast']), Tree('NN', ['bowler'])]), Tree('SBAR', [Tree('S', [Tree('NP', [Tree('NNP', ['Tushar']), Tree('NNP', ['Deshpande'])]), Tree('VP', [Tree('MD', ['will']), Tree('VP', [Tree('VB', ['be']), Tree('VP', [Tree('VBG', ['playing']), Tree('PP', [Tree('IN', ['for']), Tree('NP', [Tree('NP', [Tree('PRP$', ['his']), Tree('NN', ['team'])]), Tree('PP', [Tree('IN', ['in']), Tree('NP', [Tree('NP', [Tree('NNP', ['Syed']), Tree('NNP', ['Mushtaq']), Tree('NNP', ['Ali']), Tree('NNP', ['Trophy'])]), Tree('PP', [Tree('IN', ['on']), Tree('NP', [Tree('NNP', ['Friday'])])])])])])]), Tree('PP', [Tree('IN', ['in']), Tree('NP', [Tree('NP', [Tree('NP', [Tree('NN', ['honour'])]), Tree('PP', [Tree('IN', ['of']), Tree('NP', [Tree('PRP$', ['his']), Tree('NN', ['mother'])])])]), Tree(',', [',']), Tree('SBAR', [Tree('WHNP', [Tree('WP', ['who'])]), Tree('S', [Tree('VP', [Tree('VBD', ['passed']), Tree('PRT', [Tree('RP', ['away'])]), Tree('PP', [Tree('IN', ['of']), Tree('NP', [Tree('NN', ['cancer'])])]), Tree('PP', [Tree('IN', ['on']), Tree('NP', [Tree('NNP', ['Tuesday'])])])])])]), Tree('.', ['.'])])])])])])])])]), Tree('``', ['``']), Tree('NP', [Tree('NP', [Tree('NNP', ['Thoughts'])]), Tree('PP', [Tree('IN', ['about']), Tree('NP', [Tree('NN', ['mummy'])])])]), Tree('VP', [Tree('MD', ['will']), Tree('ADVP', [Tree('RB', ['definitely'])]), Tree('VP', [Tree('VB', ['come'])])])]), Tree(',', [',']), Tree('CC', ['but']), Tree('S', [Tree('NP', [Tree('PRP$', ['my']), Tree('NN', ['mom'])]), Tree('VP', [Tree('VBD', ['wanted']), Tree('S', [Tree('NP', [Tree('PRP', ['me'])]), Tree('VP', [Tree('TO', ['to']), Tree('VP', [Tree('VB', ['play']), Tree('ADVP', [Tree('RB', ['well'])])])])])])])]), Tree('CC', ['and']), Tree('S', [Tree('NP', [Tree('NN', ['nothing'])]), Tree('SBAR', [Tree('ADVP', [Tree('RB', ['else']), Tree('.', ['.'])]), Tree('IN', ['If']), Tree('S', [Tree('NP', [Tree('PRP', ['I'])]), Tree('VP', [Tree('VB', ['stop']), Tree('ADVP', [Tree('RB', ['right']), Tree('RB', ['now'])])])])])])])]), Tree(',', [',']), Tree('ADVP', [Tree('RB', ['then'])]), Tree('NP', [Tree('EX', ['there'])]), Tree('VP', [Tree('VBZ', [""'s""]), Tree('NP', [Tree('DT', ['no']), Tree('NN', ['point'])])])]), Tree(',', [',']), Tree(""''"", [""''""]), Tree('NP', [Tree('NNP', ['Deshpande'])]), Tree('VP', [Tree('VBD', ['said'])]), Tree('.', ['.'])])])]"
All kinds of weird: Ritika on 'brother' Yuvraj wearing Rohit's jersey,"Mumbai Indians took to Instagram to share a picture of their new signing Yuvraj Singh wearing captain Rohit Sharma's jersey with the caption, ""Guess who?"" Reacting to the picture, Rohit's wife Ritika Sajdeh wrote, ""My brother wearing my husband's jersey is all kinds of weird."" Ritika used to manage Yuvraj and had become his 'rakhi sister' during the time. ",sports,"All kinds of weird: Ritika on 'brother' Yuvraj wearing Rohit's jersey. Mumbai Indians took to Instagram to share a picture of their new signing Yuvraj Singh wearing captain Rohit Sharma's jersey with the caption, ""Guess who?"" Reacting to the picture, Rohit's wife Ritika Sajdeh wrote, ""My brother wearing my husband's jersey is all kinds of weird."" Ritika used to manage Yuvraj and had become his 'rakhi sister' during the time. ",kind weird ritika brother yuvraj wear rohit jersey mumbai indian take instagram share picture new signing yuvraj singh wear captain rohit sharma jersey caption guess react picture rohit wife ritika sajdeh write brother wear husband jersey kind weird ritika use manage yuvraj become rakhi sister time,"[Tree('ROOT', [Tree('S', [Tree('NP', [Tree('NP', [Tree('DT', ['All']), Tree('NNS', ['kinds'])]), Tree('PP', [Tree('IN', ['of']), Tree('ADJP', [Tree('JJ', ['weird'])])])]), Tree(':', [':']), Tree('S', [Tree('NP', [Tree('NP', [Tree('NNP', ['Ritika'])]), Tree('PP', [Tree('IN', ['on']), Tree('NP', [Tree('NP', [Tree('``', ['`']), Tree('NN', ['brother']), Tree(""''"", [""'""]), Tree('NNS', ['Yuvraj'])]), Tree('VP', [Tree('VBG', ['wearing']), Tree('NP', [Tree('NP', [Tree('NNP', ['Rohit']), Tree('POS', [""'s""])]), Tree('NN', ['jersey'])])])])])])]), Tree('.', ['.']), Tree('NP', [Tree('NNP', ['Mumbai']), Tree('NNPS', ['Indians'])]), Tree('VP', [Tree('VP', [Tree('VBD', ['took']), Tree('PP', [Tree('TO', ['to']), Tree('NP', [Tree('NNP', ['Instagram'])])]), Tree('S', [Tree('VP', [Tree('TO', ['to']), Tree('VP', [Tree('VB', ['share']), Tree('NP', [Tree('NP', [Tree('DT', ['a']), Tree('NN', ['picture'])]), Tree('PP', [Tree('IN', ['of']), Tree('NP', [Tree('PRP$', ['their']), Tree('JJ', ['new']), Tree('NN', ['signing']), Tree('NNP', ['Yuvraj']), Tree('NNP', ['Singh'])])])]), Tree('S', [Tree('VP', [Tree('VBG', ['wearing']), Tree('NP', [Tree('NP', [Tree('NN', ['captain']), Tree('NNP', ['Rohit']), Tree('NNP', ['Sharma']), Tree('POS', [""'s""])]), Tree('NN', ['jersey'])]), Tree('PP', [Tree('IN', ['with']), Tree('S', [Tree('NP', [Tree('NP', [Tree('DT', ['the']), Tree('NN', ['caption'])]), Tree(',', [',']), Tree('``', ['``']), Tree('S', [Tree('VP', [Tree('VB', ['Guess']), Tree('FRAG', [Tree('SBARQ', [Tree('WHNP', [Tree('WP', ['who'])]), Tree('.', ['?'])])])])]), Tree(""''"", [""''""])]), Tree('VP', [Tree('VBG', ['Reacting']), Tree('PP', [Tree('TO', ['to']), Tree('NP', [Tree('NP', [Tree('DT', ['the']), Tree('NN', ['picture'])]), Tree(',', [',']), Tree('NP', [Tree('NP', [Tree('NP', [Tree('NNP', ['Rohit']), Tree('POS', [""'s""])]), Tree('NN', ['wife'])]), Tree('SBAR', [Tree('S', [Tree('NP', [Tree('NNP', ['Ritika']), Tree('NNP', ['Sajdeh'])]), Tree('VP', [Tree('VBD', ['wrote']), Tree(',', [',']), Tree('``', ['``']), Tree('S', [Tree('NP', [Tree('PRP$', ['My']), Tree('NN', ['brother'])]), Tree('VP', [Tree('VBG', ['wearing']), Tree('SBAR', [Tree('S', [Tree('NP', [Tree('NP', [Tree('PRP$', ['my']), Tree('NN', ['husband']), Tree('POS', [""'s""])]), Tree('NN', ['jersey'])]), Tree('VP', [Tree('VBZ', ['is']), Tree('NP', [Tree('NP', [Tree('DT', ['all']), Tree('NNS', ['kinds'])]), Tree('PP', [Tree('IN', ['of']), Tree('NP', [Tree('NNP', ['weird']), Tree('.', ['.']), Tree(""''"", [""''""]), Tree('NNP', ['Ritika'])])]), Tree('VP', [Tree('VBN', ['used']), Tree('S', [Tree('VP', [Tree('TO', ['to']), Tree('VP', [Tree('VB', ['manage']), Tree('NP', [Tree('NNS', ['Yuvraj'])])])])])])])])])])])])])])])])])])])])])])])])])])]), Tree('CC', ['and']), Tree('VP', [Tree('VBD', ['had']), Tree('VP', [Tree('VBN', ['become']), Tree('NP', [Tree('PRP$', ['his']), Tree('``', ['`']), Tree('JJ', ['rakhi']), Tree('NN', ['sister']), Tree(""''"", [""'""])]), Tree('PP', [Tree('IN', ['during']), Tree('NP', [Tree('DT', ['the']), Tree('NN', ['time'])])])])])]), Tree('.', ['.'])])])]"
