news_headline,news_article,news_category,full_text,clean_text,stanford_text
Facebook adds 'Tributes' section to memorial accounts of users,"Facebook is adding a dedicated 'Tributes' section to memorialised accounts of passed-away users to post stories, commemorate a birthday or share memories. The section, separate from 'timeline', will include posts made after the day it was memorialised. Some Facebook users who have designated 'legacy contacts' to manage their accounts after they die were alerted to the feature by a notification.",technology,"Facebook adds 'Tributes' section to memorial accounts of users. Facebook is adding a dedicated 'Tributes' section to memorialised accounts of passed-away users to post stories, commemorate a birthday or share memories. The section, separate from 'timeline', will include posts made after the day it was memorialised. Some Facebook users who have designated 'legacy contacts' to manage their accounts after they die were alerted to the feature by a notification.",facebook add tribute section memorial account user facebook add dedicated tribute section memorialised account pass away user post story commemorate birthday share memory section separate timeline include post make day memorialised facebook user designate legacy contact manage account die alert feature notification,"[Tree('ROOT', [Tree('S', [Tree('NP', [Tree('NNP', ['Facebook'])]), Tree('VP', [Tree('VBZ', ['adds']), Tree('S', [Tree('``', ['`']), Tree('S', [Tree('SBAR', [Tree('X', [Tree('NP', [Tree('NP', [Tree('NP', [Tree('NNP', ['Tributes']), Tree('POS', [""'""])]), Tree('NN', ['section'])]), Tree('PP', [Tree('TO', ['to']), Tree('NP', [Tree('NN', ['memorial'])])])]), Tree('NP', [Tree('NP', [Tree('NNS', ['accounts'])]), Tree('PP', [Tree('IN', ['of']), Tree('NP', [Tree('NNS', ['users'])])])]), Tree('.', ['.'])]), Tree('S', [Tree('NP', [Tree('NNP', ['Facebook'])]), Tree('VP', [Tree('VBZ', ['is']), Tree('VP', [Tree('VBG', ['adding']), Tree('NP', [Tree('NP', [Tree('DT', ['a']), Tree('JJ', ['dedicated']), Tree('``', ['`']), Tree('NNP', ['Tributes']), Tree(""''"", [""'""]), Tree('NN', ['section'])]), Tree('PP', [Tree('TO', ['to']), Tree('NP', [Tree('NP', [Tree('JJ', ['memorialised']), Tree('NNS', ['accounts'])]), Tree('PP', [Tree('IN', ['of']), Tree('NP', [Tree('JJ', ['passed-away']), Tree('NNS', ['users'])])])])])]), Tree('S', [Tree('VP', [Tree('TO', ['to']), Tree('VP', [Tree('VB', ['post']), Tree('NP', [Tree('NNS', ['stories'])])])])])])])])]), Tree(',', [',']), Tree('S', [Tree('VP', [Tree('VB', ['commemorate']), Tree('NP', [Tree('NP', [Tree('NP', [Tree('DT', ['a']), Tree('NN', ['birthday'])]), Tree('CC', ['or']), Tree('NP', [Tree('NN', ['share']), Tree('NNS', ['memories'])]), Tree('.', ['.']), Tree('NP', [Tree('DT', ['The']), Tree('NN', ['section'])]), Tree(',', [','])]), Tree('ADJP', [Tree('JJ', ['separate']), Tree('PP', [Tree('IN', ['from']), Tree('ADJP', [Tree('``', ['`']), Tree('JJ', ['timeline']), Tree(""''"", [""'""])])])])])])]), Tree(',', [',']), Tree('VP', [Tree('MD', ['will']), Tree('VP', [Tree('VB', ['include']), Tree('NP', [Tree('NP', [Tree('NNS', ['posts'])]), Tree('VP', [Tree('VBN', ['made']), Tree('PP', [Tree('IN', ['after']), Tree('NP', [Tree('DT', ['the']), Tree('NN', ['day'])])])])])])])]), Tree('S', [Tree('NP', [Tree('PRP', ['it'])]), Tree('VP', [Tree('VBD', ['was']), Tree('VP', [Tree('VBN', ['memorialised'])])]), Tree('.', ['.'])]), Tree('S', [Tree('NP', [Tree('NP', [Tree('DT', ['Some']), Tree('NNP', ['Facebook']), Tree('NNS', ['users'])]), Tree('SBAR', [Tree('WHNP', [Tree('WP', ['who'])]), Tree('S', [Tree('VP', [Tree('VBP', ['have']), Tree('VP', [Tree('VBN', ['designated']), Tree('``', ['`']), Tree('NP', [Tree('NN', ['legacy']), Tree('NNS', ['contacts'])]), Tree(""''"", [""'""]), Tree('S', [Tree('VP', [Tree('TO', ['to']), Tree('VP', [Tree('VB', ['manage']), Tree('NP', [Tree('PRP$', ['their']), Tree('NNS', ['accounts'])]), Tree('SBAR', [Tree('IN', ['after']), Tree('S', [Tree('NP', [Tree('PRP', ['they'])]), Tree('VP', [Tree('VBP', ['die'])])])])])])])])])])])]), Tree('VP', [Tree('VBD', ['were']), Tree('VP', [Tree('VBN', ['alerted']), Tree('PP', [Tree('TO', ['to']), Tree('NP', [Tree('DT', ['the']), Tree('NN', ['feature'])])]), Tree('PP', [Tree('IN', ['by']), Tree('NP', [Tree('DT', ['a']), Tree('NN', ['notification'])])])])])])])]), Tree('.', ['.'])])])]"
Most Indian users unaware of how to report abuse: Twitter,"Most Indian users aren't aware of how to report abuse or harassment they face on Twitter, Global Public Policy VP Colin Crowell said. ""Users might take a screenshot of abuse or harassment [and post it online]...but they don't report that,"" he said. ""Our team can only take action if the issue is reported to us,"" he added.",technology,"Most Indian users unaware of how to report abuse: Twitter. Most Indian users aren't aware of how to report abuse or harassment they face on Twitter, Global Public Policy VP Colin Crowell said. ""Users might take a screenshot of abuse or harassment [and post it online]...but they don't report that,"" he said. ""Our team can only take action if the issue is reported to us,"" he added.",indian user unaware report abuse twitter indian user not aware report abuse harassment face twitter global public policy vp colin crowell say user may take screenshot abuse harassment [ post online ] not report say team take action issue report us add,"[Tree('ROOT', [Tree('S', [Tree('S', [Tree('NP', [Tree('JJS', ['Most']), Tree('JJ', ['Indian']), Tree('NNS', ['users'])]), Tree('ADJP', [Tree('JJ', ['unaware']), Tree('PP', [Tree('IN', ['of']), Tree('SBAR', [Tree('WHADVP', [Tree('WRB', ['how'])]), Tree('S', [Tree('VP', [Tree('TO', ['to']), Tree('VP', [Tree('VB', ['report']), Tree('NP', [Tree('NN', ['abuse'])])])])])])])])]), Tree(':', [':']), Tree('S', [Tree('NP', [Tree('NP', [Tree('NNP', ['Twitter']), Tree('.', ['.'])]), Tree('SBAR', [Tree('S', [Tree('NP', [Tree('JJS', ['Most']), Tree('JJ', ['Indian']), Tree('NNS', ['users'])]), Tree('VP', [Tree('VBP', ['are']), Tree('RB', [""n't""]), Tree('ADJP', [Tree('JJ', ['aware']), Tree('PP', [Tree('IN', ['of']), Tree('SBAR', [Tree('WHADVP', [Tree('WRB', ['how'])]), Tree('S', [Tree('VP', [Tree('TO', ['to']), Tree('VP', [Tree('VB', ['report']), Tree('NP', [Tree('NP', [Tree('NN', ['abuse']), Tree('CC', ['or']), Tree('NN', ['harassment'])]), Tree('SBAR', [Tree('S', [Tree('NP', [Tree('PRP', ['they'])]), Tree('VP', [Tree('VBP', ['face']), Tree('PP', [Tree('IN', ['on']), Tree('NP', [Tree('NNP', ['Twitter']), Tree(',', [',']), Tree('JJ', ['Global']), Tree('NNP', ['Public']), Tree('NNP', ['Policy']), Tree('NNP', ['VP']), Tree('NNP', ['Colin']), Tree('NNP', ['Crowell'])])])])])])])])])])])])])])])])]), Tree('VP', [Tree('VBD', ['said'])])]), Tree('.', ['.']), Tree('``', ['``']), Tree('S', [Tree('NP', [Tree('NNP', ['Users'])]), Tree('VP', [Tree('MD', ['might']), Tree('VP', [Tree('VP', [Tree('VB', ['take']), Tree('NP', [Tree('NP', [Tree('DT', ['a']), Tree('NN', ['screenshot'])]), Tree('PP', [Tree('IN', ['of']), Tree('NP', [Tree('NN', ['abuse']), Tree('CC', ['or']), Tree('NN', ['harassment']), Tree('NNS', ['-LSB-'])])])])]), Tree('CC', ['and']), Tree('VP', [Tree('VB', ['post']), Tree('NP', [Tree('PRP', ['it'])]), Tree('PP', [Tree('NN', ['online']), Tree('NP', [Tree('NNP', ['-RSB-'])])])])])])]), Tree(':', ['...']), Tree('CC', ['but']), Tree('S', [Tree('S', [Tree('NP', [Tree('PRP', ['they'])]), Tree('VP', [Tree('VBP', ['do']), Tree('RB', [""n't""]), Tree('VP', [Tree('VB', ['report']), Tree('NP', [Tree('DT', ['that'])])])])]), Tree(',', [',']), Tree(""''"", [""''""]), Tree('NP', [Tree('PRP', ['he'])]), Tree('VP', [Tree('VBD', ['said'])])]), Tree('.', ['.']), Tree('``', ['``']), Tree('S', [Tree('S', [Tree('NP', [Tree('PRP$', ['Our']), Tree('NN', ['team'])]), Tree('VP', [Tree('MD', ['can']), Tree('ADVP', [Tree('RB', ['only'])]), Tree('VP', [Tree('VB', ['take']), Tree('NP', [Tree('NN', ['action'])]), Tree('SBAR', [Tree('IN', ['if']), Tree('S', [Tree('NP', [Tree('DT', ['the']), Tree('NN', ['issue'])]), Tree('VP', [Tree('VBZ', ['is']), Tree('VP', [Tree('VBN', ['reported']), Tree('PP', [Tree('TO', ['to']), Tree('NP', [Tree('PRP', ['us'])])])])])])])])])]), Tree(',', [',']), Tree(""''"", [""''""]), Tree('NP', [Tree('PRP', ['he'])]), Tree('VP', [Tree('VBD', ['added'])])]), Tree('.', ['.'])])])]"
"Google discloses security flaw in macOS kernel, Apple works on fix","Google's security disclosure program named 'Project Zero' has exposed a 'high severity' security flaw in macOS kernel, which it had first disclosed to Apple in November last year. The flaw allows modification of a user-mounted filesystem image without notifying the virtual management system. Apple is intending to resolve the issue in a future release, researchers said.",technology,"Google discloses security flaw in macOS kernel, Apple works on fix. Google's security disclosure program named 'Project Zero' has exposed a 'high severity' security flaw in macOS kernel, which it had first disclosed to Apple in November last year. The flaw allows modification of a user-mounted filesystem image without notifying the virtual management system. Apple is intending to resolve the issue in a future release, researchers said.",google disclose security flaw macos kernel apple work fix google security disclosure program name project zero expose high severity security flaw macos kernel first disclose apple november last year flaw allow modification user mount filesystem image without notify virtual management system apple intend resolve issue future release researcher say,"[Tree('ROOT', [Tree('S', [Tree('NP', [Tree('NNP', ['Google'])]), Tree('VP', [Tree('VBZ', ['discloses']), Tree('NP', [Tree('NN', ['security']), Tree('NN', ['flaw'])]), Tree('PP', [Tree('IN', ['in']), Tree('NP', [Tree('NP', [Tree('NP', [Tree('NNS', ['macOS'])]), Tree('NP', [Tree('NN', ['kernel'])])]), Tree(',', [',']), Tree('NP', [Tree('NP', [Tree('NNP', ['Apple']), Tree('NNS', ['works'])]), Tree('PP', [Tree('IN', ['on']), Tree('NP', [Tree('NN', ['fix'])])])]), Tree('.', ['.']), Tree('NP', [Tree('NP', [Tree('NP', [Tree('NNP', ['Google']), Tree('POS', [""'s""])]), Tree('NN', ['security']), Tree('NN', ['disclosure']), Tree('NN', ['program'])]), Tree('VP', [Tree('VBN', ['named']), Tree('NP', [Tree('``', ['`']), Tree('NP', [Tree('NNP', ['Project']), Tree('NNP', ['Zero'])]), Tree(""''"", [""'""]), Tree('SBAR', [Tree('S', [Tree('VP', [Tree('VBZ', ['has']), Tree('VP', [Tree('VBN', ['exposed']), Tree('NP', [Tree('DT', ['a']), Tree('``', ['`']), Tree('JJ', ['high']), Tree('NN', ['severity']), Tree(""''"", [""'""]), Tree('NN', ['security']), Tree('NN', ['flaw'])]), Tree('PP', [Tree('IN', ['in']), Tree('NP', [Tree('NP', [Tree('JJ', ['macOS']), Tree('NN', ['kernel'])]), Tree(',', [',']), Tree('SBAR', [Tree('WHNP', [Tree('WDT', ['which'])]), Tree('S', [Tree('NP', [Tree('PRP', ['it'])]), Tree('VP', [Tree('VBD', ['had']), Tree('ADVP', [Tree('RB', ['first'])]), Tree('VP', [Tree('VBN', ['disclosed']), Tree('PP', [Tree('TO', ['to']), Tree('NP', [Tree('NP', [Tree('NNP', ['Apple'])]), Tree('PP', [Tree('IN', ['in']), Tree('NP', [Tree('NNP', ['November'])])])])]), Tree('NP', [Tree('JJ', ['last']), Tree('NN', ['year'])])])])])])])])])])])])])])]), Tree('.', ['.']), Tree('NP', [Tree('NP', [Tree('DT', ['The']), Tree('NN', ['flaw'])]), Tree('SBAR', [Tree('S', [Tree('VP', [Tree('VBZ', ['allows']), Tree('NP', [Tree('NP', [Tree('NN', ['modification'])]), Tree('PP', [Tree('IN', ['of']), Tree('NP', [Tree('DT', ['a']), Tree('JJ', ['user-mounted']), Tree('NN', ['filesystem']), Tree('NN', ['image'])])])]), Tree('PP', [Tree('IN', ['without']), Tree('S', [Tree('VP', [Tree('VBG', ['notifying']), Tree('NP', [Tree('DT', ['the']), Tree('JJ', ['virtual']), Tree('NN', ['management']), Tree('NN', ['system'])])])])])])])])]), Tree('.', ['.']), Tree('NP', [Tree('NP', [Tree('NNP', ['Apple'])]), Tree('SBAR', [Tree('S', [Tree('VP', [Tree('VBZ', ['is']), Tree('VP', [Tree('VBG', ['intending']), Tree('S', [Tree('VP', [Tree('TO', ['to']), Tree('VP', [Tree('VB', ['resolve']), Tree('NP', [Tree('NP', [Tree('DT', ['the']), Tree('NN', ['issue'])]), Tree('PP', [Tree('IN', ['in']), Tree('NP', [Tree('DT', ['a']), Tree('JJ', ['future']), Tree('NN', ['release'])])])])])])])])])])])]), Tree(',', [',']), Tree('NP', [Tree('NP', [Tree('NNS', ['researchers'])]), Tree('VP', [Tree('VBD', ['said'])])])])])]), Tree('.', ['.'])])])]"
Some apps still send user data to FB without consent: Report,"Some apps, including search service Yelp and language learning platform Duolingo, are still sending personal data without user consent to Facebook for ad tracking, as per a report. This comes after the social media platform faced criticism for paying and collecting data of teenagers in India and the US. Duolingo has reportedly agreed to suspend the practice.",technology,"Some apps still send user data to FB without consent: Report. Some apps, including search service Yelp and language learning platform Duolingo, are still sending personal data without user consent to Facebook for ad tracking, as per a report. This comes after the social media platform faced criticism for paying and collecting data of teenagers in India and the US. Duolingo has reportedly agreed to suspend the practice.",app still send user datum fb without consent report app include search service yelp language learn platform duolingo still send personal datum without user consent facebook ad tracking per report come social medium platform face criticism pay collect datum teenager india us duolingo reportedly agree suspend practice,"[Tree('ROOT', [Tree('S', [Tree('S', [Tree('NP', [Tree('DT', ['Some']), Tree('NNS', ['apps'])]), Tree('ADVP', [Tree('RB', ['still'])]), Tree('VP', [Tree('VB', ['send']), Tree('S', [Tree('NP', [Tree('NN', ['user']), Tree('NNS', ['data'])]), Tree('VP', [Tree('TO', ['to']), Tree('VP', [Tree('VB', ['FB']), Tree('PP', [Tree('IN', ['without']), Tree('NP', [Tree('NN', ['consent'])])])])])])])]), Tree(':', [':']), Tree('S', [Tree('NP', [Tree('NP', [Tree('NP', [Tree('NNP', ['Report']), Tree('.', ['.'])]), Tree('NP', [Tree('DT', ['Some']), Tree('NNS', ['apps'])])]), Tree(',', [',']), Tree('PP', [Tree('VBG', ['including']), Tree('NP', [Tree('NN', ['search']), Tree('NN', ['service']), Tree('NN', ['Yelp']), Tree('CC', ['and']), Tree('NN', ['language']), Tree('NN', ['learning']), Tree('NN', ['platform']), Tree('NNP', ['Duolingo'])])]), Tree(',', [','])]), Tree('VP', [Tree('VBP', ['are']), Tree('ADVP', [Tree('RB', ['still'])]), Tree('VP', [Tree('VBG', ['sending']), Tree('NP', [Tree('JJ', ['personal']), Tree('NNS', ['data'])]), Tree('PP', [Tree('IN', ['without']), Tree('NP', [Tree('NN', ['user']), Tree('NN', ['consent'])])]), Tree('PP', [Tree('TO', ['to']), Tree('NP', [Tree('NP', [Tree('NNP', ['Facebook'])]), Tree('PP', [Tree('IN', ['for']), Tree('NP', [Tree('NN', ['ad']), Tree('NN', ['tracking'])])])])]), Tree(',', [',']), Tree('SBAR', [Tree('IN', ['as']), Tree('S', [Tree('S', [Tree('FRAG', [Tree('PP', [Tree('IN', ['per']), Tree('NP', [Tree('DT', ['a']), Tree('NN', ['report'])])]), Tree('.', ['.'])]), Tree('NP', [Tree('DT', ['This'])]), Tree('VP', [Tree('VBZ', ['comes']), Tree('SBAR', [Tree('IN', ['after']), Tree('S', [Tree('NP', [Tree('DT', ['the']), Tree('JJ', ['social']), Tree('NNS', ['media']), Tree('NN', ['platform'])]), Tree('VP', [Tree('VBD', ['faced']), Tree('NP', [Tree('NN', ['criticism'])]), Tree('PP', [Tree('IN', ['for']), Tree('S', [Tree('VP', [Tree('VBG', ['paying']), Tree('CC', ['and']), Tree('VBG', ['collecting']), Tree('NP', [Tree('NP', [Tree('NNS', ['data'])]), Tree('PP', [Tree('IN', ['of']), Tree('NP', [Tree('NP', [Tree('NNS', ['teenagers'])]), Tree('PP', [Tree('IN', ['in']), Tree('NP', [Tree('NNP', ['India'])])])])])])])])])])])])])]), Tree('CC', ['and']), Tree('S', [Tree('NP', [Tree('DT', ['the']), Tree('NNP', ['US']), Tree('.', ['.']), Tree('NNP', ['Duolingo'])]), Tree('VP', [Tree('VBZ', ['has']), Tree('ADVP', [Tree('RB', ['reportedly'])]), Tree('VP', [Tree('VBN', ['agreed']), Tree('S', [Tree('VP', [Tree('TO', ['to']), Tree('VP', [Tree('VB', ['suspend']), Tree('NP', [Tree('DT', ['the']), Tree('NN', ['practice'])])])])])])])])])])])])]), Tree('.', ['.'])])])]"
Twitter was too aggressive in banning certain accounts: CEO ,"Twitter CEO Jack Dorsey in a recent interview said the platform admits it was ""probably too aggressive"" in banning certain accounts. The suspensions relate to hashtag ""learn to code"" that was being used as a ""co-ordinated harassment campaign"" to target certain journalists, as per Twitter. Dorsey explained that lack of context concerning the tweets may have led to the bans.",technology,"Twitter was too aggressive in banning certain accounts: CEO . Twitter CEO Jack Dorsey in a recent interview said the platform admits it was ""probably too aggressive"" in banning certain accounts. The suspensions relate to hashtag ""learn to code"" that was being used as a ""co-ordinated harassment campaign"" to target certain journalists, as per Twitter. Dorsey explained that lack of context concerning the tweets may have led to the bans.",twitter aggressive ban certain account ceo twitter ceo jack dorsey recent interview say platform admit probably aggressive ban certain account suspension relate hashtag learn code use co ordinate harassment campaign target certain journalist per twitter dorsey explain lack context concern tweet may lead ban,"[Tree('ROOT', [Tree('S', [Tree('S', [Tree('NP', [Tree('NNP', ['Twitter'])]), Tree('VP', [Tree('VBD', ['was']), Tree('ADJP', [Tree('RB', ['too']), Tree('JJ', ['aggressive']), Tree('PP', [Tree('IN', ['in']), Tree('S', [Tree('VP', [Tree('VBG', ['banning']), Tree('NP', [Tree('NP', [Tree('JJ', ['certain']), Tree('NNS', ['accounts'])]), Tree('UCP', [Tree(':', [':']), Tree('S', [Tree('NP', [Tree('NP', [Tree('NNP', ['CEO']), Tree('.', ['.']), Tree('NNP', ['Twitter']), Tree('NNP', ['CEO']), Tree('NNP', ['Jack']), Tree('NNP', ['Dorsey'])]), Tree('PP', [Tree('IN', ['in']), Tree('NP', [Tree('DT', ['a']), Tree('JJ', ['recent']), Tree('NN', ['interview'])])])]), Tree('VP', [Tree('VBD', ['said']), Tree('SBAR', [Tree('S', [Tree('NP', [Tree('DT', ['the']), Tree('NN', ['platform'])]), Tree('VP', [Tree('VBZ', ['admits']), Tree('SBAR', [Tree('S', [Tree('NP', [Tree('PRP', ['it'])]), Tree('VP', [Tree('VBD', ['was']), Tree('``', ['``']), Tree('ADVP', [Tree('RB', ['probably'])]), Tree('ADJP', [Tree('RB', ['too']), Tree('JJ', ['aggressive'])]), Tree(""''"", [""''""]), Tree('PP', [Tree('IN', ['in']), Tree('S', [Tree('VP', [Tree('VBG', ['banning']), Tree('NP', [Tree('JJ', ['certain']), Tree('NNS', ['accounts'])])])])])])])])])])])])]), Tree('.', ['.'])])])])])])])])]), Tree('NP', [Tree('DT', ['The']), Tree('NNS', ['suspensions'])]), Tree('VP', [Tree('VBP', ['relate']), Tree('S', [Tree('VP', [Tree('TO', ['to']), Tree('VP', [Tree('VB', ['hashtag']), Tree('VP', [Tree('``', ['``']), Tree('VB', ['learn']), Tree('S', [Tree('VP', [Tree('TO', ['to']), Tree('VP', [Tree('VB', ['code']), Tree(""''"", [""''""]), Tree('SBAR', [Tree('IN', ['that']), Tree('S', [Tree('VP', [Tree('VBD', ['was']), Tree('VP', [Tree('VBG', ['being']), Tree('VP', [Tree('VBN', ['used']), Tree('PP', [Tree('IN', ['as']), Tree('NP', [Tree('DT', ['a']), Tree('``', ['``']), Tree('JJ', ['co-ordinated']), Tree('NN', ['harassment']), Tree('NN', ['campaign']), Tree(""''"", [""''""])])]), Tree('S', [Tree('VP', [Tree('TO', ['to']), Tree('VP', [Tree('VB', ['target']), Tree('NP', [Tree('JJ', ['certain']), Tree('NNS', ['journalists'])])])])])])])])])])])])]), Tree(',', [',']), Tree('PP', [Tree('IN', ['as']), Tree('IN', ['per']), Tree('NP', [Tree('NP', [Tree('NNP', ['Twitter']), Tree('.', ['.'])]), Tree('SBAR', [Tree('S', [Tree('NP', [Tree('NNP', ['Dorsey'])]), Tree('VP', [Tree('VBD', ['explained']), Tree('SBAR', [Tree('IN', ['that']), Tree('S', [Tree('NP', [Tree('NP', [Tree('NN', ['lack'])]), Tree('PP', [Tree('IN', ['of']), Tree('NP', [Tree('NP', [Tree('NN', ['context'])]), Tree('PP', [Tree('VBG', ['concerning']), Tree('NP', [Tree('DT', ['the']), Tree('NNS', ['tweets'])])])])])]), Tree('VP', [Tree('MD', ['may']), Tree('VP', [Tree('VB', ['have']), Tree('VP', [Tree('VBN', ['led']), Tree('PP', [Tree('TO', ['to']), Tree('NP', [Tree('DT', ['the']), Tree('NNS', ['bans'])])])])])])])])])])])])])])])])])]), Tree('.', ['.'])])])]"
Facebook sees its future in private chats: Mark Zuckerberg,"Facebook CEO Mark Zuckerberg has said the future of communications will shift more to private, encrypted chats and Facebook aims to help bring this change. ""I believe a privacy-focused communications platform will become even more important than today's open platforms,"" he said. ""Working towards implementing end-to-end encryption for all private communications is the right thing to do,"" he added.",technology,"Facebook sees its future in private chats: Mark Zuckerberg. Facebook CEO Mark Zuckerberg has said the future of communications will shift more to private, encrypted chats and Facebook aims to help bring this change. ""I believe a privacy-focused communications platform will become even more important than today's open platforms,"" he said. ""Working towards implementing end-to-end encryption for all private communications is the right thing to do,"" he added.",facebook see future private chat mark zuckerberg facebook ceo mark zuckerberg say future communication shift private encrypted chat facebook aim help bring change believe privacy focus communication platform become even important today open platform say work towards implement end end encryption private communication right thing add,"[Tree('ROOT', [Tree('S', [Tree('S', [Tree('NP', [Tree('NNP', ['Facebook'])]), Tree('VP', [Tree('VBZ', ['sees']), Tree('NP', [Tree('PRP$', ['its']), Tree('NN', ['future'])]), Tree('PP', [Tree('IN', ['in']), Tree('NP', [Tree('JJ', ['private']), Tree('NNS', ['chats'])])])])]), Tree(':', [':']), Tree('S', [Tree('NP', [Tree('NNP', ['Mark']), Tree('NNP', ['Zuckerberg']), Tree('.', ['.']), Tree('NNP', ['Facebook']), Tree('NNP', ['CEO']), Tree('NNP', ['Mark']), Tree('NNP', ['Zuckerberg'])]), Tree('VP', [Tree('VBZ', ['has']), Tree('VP', [Tree('VBD', ['said']), Tree('SBAR', [Tree('S', [Tree('NP', [Tree('NP', [Tree('DT', ['the']), Tree('NN', ['future'])]), Tree('PP', [Tree('IN', ['of']), Tree('NP', [Tree('NNS', ['communications'])])])]), Tree('VP', [Tree('MD', ['will']), Tree('VP', [Tree('VB', ['shift']), Tree('NP', [Tree('JJR', ['more'])]), Tree('PP', [Tree('TO', ['to']), Tree('NP', [Tree('JJ', ['private']), Tree(',', [',']), Tree('JJ', ['encrypted']), Tree('NNS', ['chats'])])])])])])])])])]), Tree('CC', ['and']), Tree('S', [Tree('NP', [Tree('NNP', ['Facebook'])]), Tree('VP', [Tree('VBZ', ['aims']), Tree('S', [Tree('VP', [Tree('TO', ['to']), Tree('VP', [Tree('VB', ['help']), Tree('VP', [Tree('VB', ['bring']), Tree('NP', [Tree('DT', ['this']), Tree('NN', ['change'])])])])])])])]), Tree('.', ['.']), Tree('``', ['``']), Tree('S', [Tree('S', [Tree('NP', [Tree('PRP', ['I'])]), Tree('VP', [Tree('VBP', ['believe']), Tree('SBAR', [Tree('S', [Tree('NP', [Tree('DT', ['a']), Tree('JJ', ['privacy-focused']), Tree('NNS', ['communications']), Tree('NN', ['platform'])]), Tree('VP', [Tree('MD', ['will']), Tree('VP', [Tree('VB', ['become']), Tree('ADJP', [Tree('RB', ['even']), Tree('RBR', ['more']), Tree('JJ', ['important'])]), Tree('PP', [Tree('IN', ['than']), Tree('NP', [Tree('NP', [Tree('NN', ['today']), Tree('POS', [""'s""])]), Tree('JJ', ['open']), Tree('NNS', ['platforms'])])])])])])])])]), Tree(',', [',']), Tree(""''"", [""''""]), Tree('NP', [Tree('PRP', ['he'])]), Tree('VP', [Tree('VBD', ['said'])])]), Tree('.', ['.']), Tree('``', ['``']), Tree('S', [Tree('S', [Tree('NP', [Tree('NP', [Tree('NNP', ['Working'])]), Tree('PP', [Tree('IN', ['towards']), Tree('S', [Tree('VP', [Tree('VBG', ['implementing']), Tree('NP', [Tree('JJ', ['end-to-end']), Tree('NN', ['encryption'])]), Tree('PP', [Tree('IN', ['for']), Tree('NP', [Tree('DT', ['all']), Tree('JJ', ['private']), Tree('NNS', ['communications'])])])])])])]), Tree('VP', [Tree('VBZ', ['is']), Tree('NP', [Tree('DT', ['the']), Tree('JJ', ['right']), Tree('NN', ['thing']), Tree('S', [Tree('VP', [Tree('TO', ['to']), Tree('VP', [Tree('VB', ['do'])])])])])])]), Tree(',', [',']), Tree(""''"", [""''""]), Tree('NP', [Tree('PRP', ['he'])]), Tree('VP', [Tree('VBD', ['added'])])]), Tree('.', ['.'])])])]"
